date_modeled,date_start,date_end,poll_subject,pollster,poll_grade,poll_type,poll_weight,poll_influence,poll_multi_version,population,party,sample_size,pct_concern_very,pct_concern_some,pct_concern_not_very,pct_concern_none,pct_concern_very_adjusted,pct_concern_some_adjusted,pct_concern_not_very_adjusted,pct_concern_none_adjusted,timestamp,poll_url
2020-10-14,2020-10-11,2020-10-13,1,YouGov,B,0,0.57064789,0.57064789,False,rv,all,1500.0,21.0,42.0,24.0,14.0,25.450464,39.378439,21.721761,13.715038,21:45:23 14 Oct 2020,https://docs.cdn.yougov.com/1ace2lgidt/econTabReport.pdf
2020-10-14,2020-10-05,2020-10-11,0,SurveyMonkey,D-,0,0.34019687,0.32836817,False,a,all,66877.0,62.0,28.0,7.0,3.0,57.572694,30.31194,8.3640505,3.2894735,21:45:20 14 Oct 2020,https://www.surveymonkey.com/curiosity/nbc-poll-covid-oct11/
2020-10-14,2020-10-09,2020-10-11,1,YouGov,B,0,0.53564067,0.49921088,False,rv,all,1525.0,23.0,41.0,21.0,15.0,27.450464,38.378439,18.721761,14.715038,21:45:23 14 Oct 2020,https://docs.cdn.yougov.com/7h9ohi94io/20201011_yahoo_coronavirus_tabs.pdf
2020-10-14,2020-10-08,2020-10-10,0,Morning Consult,B/C,0,0.44356342,0.44356342,False,a,all,2200.0,59.0,27.0,5.0,3.0,56.109742,30.503972,8.2688006,3.6497741,21:45:20 14 Oct 2020,https://assets.morningconsult.com/wp-uploads/2020/10/12135446/201033_crosstabs_CORONAVIRUS_CONTENT_Adults_v1_YW.pdf
2020-10-14,2020-10-06,2020-10-09,1,ABC News/The Washington Post,A+,0,1.8257447,1.5917891,False,rv,all,879.0,29.0,36.0,15.0,12.0,32.241627,35.513427,14.403735,10.150696,21:45:23 14 Oct 2020,https://www.langerresearch.com//wp-content//uploads//1218a12020ElectionUpdate.pdf
2020-10-14,2020-09-28,2020-10-04,0,SurveyMonkey,D-,0,0.21063066,0.15254747,False,a,all,50146.0,61.0,29.0,7.0,3.0,56.572694,31.31194,8.3640505,3.2894735,21:45:20 14 Oct 2020,https://www.surveymonkey.com/curiosity/nbc-poll-covid-oct4/
2020-10-14,2020-10-01,2020-10-04,0,Morning Consult,B/C,0,0.35347982,0.28083973,False,a,all,2200.0,58.0,26.0,5.0,3.0,55.109742,29.503972,8.2688006,3.6497741,21:45:20 14 Oct 2020,https://assets.morningconsult.com/wp-uploads/2020/10/05133150/2009146_crosstabs_CORONAVIRUS_CONTENT_Adults_v2_JB.pdf
2020-10-14,2020-10-02,2020-10-03,0,Morning Consult,B/C,0,0.16067264,0.12765442,False,a,all,1000.0,53.0,32.0,6.0,4.0,50.109742,35.503972,9.2688006,4.6497741,21:45:20 14 Oct 2020,https://morningconsult.com/form/reaction-poll-trump-covid/
2020-10-14,2020-10-02,2020-10-03,1,YouGov,B,0,0.34073095,0.23710489,False,rv,all,1200.0,22.0,39.0,26.0,13.0,26.450464,36.378439,23.721761,12.715038,21:45:23 14 Oct 2020,https://docs.cdn.yougov.com/y0zw7c7mm7/20201003_yahoo_coronavirus_tabs.pdf
2020-10-14,2020-10-02,2020-10-03,1,Ipsos,B-,0,0.63393617,0.44505195,False,a,all,506.0,37.0,44.0,13.0,6.0,36.706481,40.438749,13.801208,8.206017,21:45:23 14 Oct 2020,https://www.ipsos.com/sites/default/files/ct/news/documents/2020-10/topline-abc-trump-covid-positive-2020.pdf
2020-10-14,2020-10-02,2020-10-02,0,Morning Consult,B/C,0,0.1589232,0.12078788,False,a,all,1000.0,55.0,30.0,6.0,2.0,52.109742,33.503972,9.2688006,2.6497741,21:45:20 14 Oct 2020,https://morningconsult.com/form/reaction-poll-trump-covid/
2020-10-14,2020-10-01,2020-10-02,1,YouGov,B,0,0.41763944,0.27645292,False,rv,all,1504.0,20.0,35.0,28.0,17.0,24.450464,32.378439,25.721761,16.715038,21:45:23 14 Oct 2020,https://docs.cdn.yougov.com/qmlxn6ghki/20201002_yahoo_coronavirus_tabs.pdf
2020-10-14,2020-09-27,2020-09-30,1,YouGov,B,0,0.40343015,0.22499138,False,rv,all,1500.0,20.0,41.0,25.0,15.0,24.450464,38.378439,22.721761,14.715038,21:45:23 14 Oct 2020,https://docs.cdn.yougov.com/9k0tqsqgue/econTabReport.pdf
2020-10-14,2020-09-21,2020-09-27,0,SurveyMonkey,D-,0,0.19491573,0.09298741,False,a,all,48241.0,59.0,29.0,7.0,3.0,54.572694,31.31194,8.3640505,3.2894735,21:45:20 14 Oct 2020,https://www.surveymonkey.com/curiosity/nbc-poll-covid-sept27/
2020-10-14,2020-09-25,2020-09-27,0,Morning Consult,B/C,0,0.33796752,0.18566006,False,a,all,2200.0,53.0,31.0,7.0,2.0,50.109742,34.503972,10.268801,2.6497741,21:45:20 14 Oct 2020,https://assets.morningconsult.com/wp-uploads/2020/09/28123730/2009107_crosstabs_CORONAVIRUS_CONTENT_Adults_v2_JB.pdf
2020-10-14,2020-09-24,2020-09-26,0,Harris Insights & Analytics,C,0,0.57135491,0.29023659,False,a,all,1971.0,52.0,35.0,9.0,4.0,54.148549,32.831347,8.931115,3.0396212,21:45:20 14 Oct 2020,https://theharrispoll.com/wp-content/uploads/2020/09/Wave-31_Banner-3.pdf
2020-10-14,2020-09-19,2020-09-25,1,Echelon Insights,,0,0.81335573,0.28839119,False,lv,all,1018.0,49.0,26.0,24.0,1.0,39.860174,29.126997,23.73578,5.8683142,21:45:23 14 Oct 2020,https://echeloninsights.com/in-the-news/september-omnibus-covid/
2020-10-14,2020-09-21,2020-09-24,1,ABC News/The Washington Post,A+,0,2.067435,0.81014744,False,a,all,1008.0,29.0,33.0,18.0,15.0,32.241627,32.513427,17.403735,13.150696,21:45:23 14 Oct 2020,https://www.langerresearch.com/wp-content/uploads/1217a2The2020Election.pdf
2020-10-14,2020-09-21,2020-09-23,1,YouGov,B,0,0.33393786,0.10297892,False,rv,all,1284.0,22.0,42.0,22.0,13.0,26.450464,39.378439,19.721761,12.715038,21:45:23 14 Oct 2020,https://docs.cdn.yougov.com/o6p3vjhvnt/20200924_yahoo_coronavirus_tabs.pdf
2020-10-14,2020-09-20,2020-09-22,1,YouGov,B,0,0.39121062,0.10622625,False,a,all,1500.0,24.0,36.0,26.0,14.0,28.450464,33.378439,23.721761,13.715038,21:45:23 14 Oct 2020,https://docs.cdn.yougov.com/b8ow3q7r1e/econTabReport.pdf
2020-10-14,2020-09-17,2020-09-21,1,Global Strategy Group/GBAO/Navigator Research,,0,0.56949366,0.13643076,False,rv,all,1230.0,36.0,32.5,20.5,11.0,32.48797,33.949109,19.947611,12.118814,21:45:23 14 Oct 2020,https://navigatorresearch.org/wp-content/uploads/2020/09/Navigating-Coronavirus-Full-Topline-F09.21.20.pdf
2020-10-14,2020-09-14,2020-09-20,0,SurveyMonkey,D-,0,0.16459518,0.03424946,False,a,all,36454.0,61.0,28.0,7.0,3.0,56.572694,30.31194,8.3640505,3.2894735,21:45:20 14 Oct 2020,https://www.surveymonkey.com/curiosity/nbc-poll-covid-sept20/
2020-10-14,2020-09-18,2020-09-20,0,Morning Consult,B/C,0,0.36111626,0.10402524,False,a,all,2200.0,57.0,29.0,4.0,2.0,54.109742,32.503972,7.2688006,2.6497741,21:45:20 14 Oct 2020,https://assets.morningconsult.com/wp-uploads/2020/09/21134349/200974_crosstabs_CORONAVIRUS_CONTENT_Adults_v2_JB.pdf
2020-10-14,2020-09-18,2020-09-20,1,Léger,,0,0.430184,0.09370598,False,a,all,1001.0,22.0,36.0,20.0,17.0,25.820666,35.464003,20.321945,14.301862,21:45:23 14 Oct 2020,https://leger360.com/wp-content/uploads/2020/09/Sondage-hebdomadaire-de-Le%CC%81ger-21-septembre-2020-min.pdf
2020-10-14,2020-09-17,2020-09-19,0,Harris Insights & Analytics,C,0,0.44979358,0.11972583,False,a,all,1949.0,47.0,38.0,11.0,5.0,49.148549,35.831347,10.931115,4.0396212,21:45:20 14 Oct 2020,https://theharrispoll.com/wp-content/uploads/2020/09/Wave-30_tabs_Banner-2.pdf
2020-10-14,2020-09-18,2020-09-19,1,Ipsos,B-,0,0.56796252,0.12555416,False,a,all,528.0,29.0,43.0,19.0,10.0,28.706481,39.438749,19.801208,12.206017,21:45:23 14 Oct 2020,https://www.scribd.com/document/476678932/ABC-Ipsos-Poll-Sept-20?secret_password=injocUl2Vvuj19L7OvQf
2020-10-14,2020-09-13,2020-09-15,1,YouGov,B,0,0.38507821,0.04009934,False,a,all,1500.0,22.0,38.0,28.0,13.0,26.450464,35.378439,25.721761,12.715038,21:45:23 14 Oct 2020,https://docs.cdn.yougov.com/t0hi1tcqs5/econTabReport.pdf
2020-10-14,2020-09-15,2020-09-15,1,Data for Progress,B-,0,0.91794083,0.14794717,False,a,all,953.0,32.55,34.74,20.21,11.45,32.398019,33.678534,20.504531,11.596414,21:45:23 14 Oct 2020,https://docs.google.com/spreadsheets/d/1pl2c_Zzxf00T3_5uba-8BdnCCCEGqtQ10kFQCc0Uo-U/edit
2020-10-14,2020-09-10,2020-09-14,1,Global Strategy Group/GBAO/Navigator Research,,0,0.43971504,0.0465942,False,rv,all,1007.0,37.0,32.0,21.5,9.5,33.48797,33.449109,20.947611,10.618814,21:45:23 14 Oct 2020,https://navigatorresearch.org/wp-content/uploads/2020/09/Navigator-Tracker-Topline-F09.15.20-PR.pdf
2020-10-14,2020-09-11,2020-09-14,1,AP-NORC,,0,1.3903179,0.18701888,False,a,all,1108.0,38.0,31.0,22.0,9.0,34.516904,31.979967,22.091302,10.432568,21:45:23 14 Oct 2020,https://apnorc.org/wp-content/uploads/2020/09/topline_september_covid.docx.pdf
2020-10-14,2020-09-11,2020-09-14,1,YouGov,B,0,0.25486251,0.02313137,False,a,all,1000.0,31.0,33.0,22.0,9.0,35.450464,30.378439,19.721761,8.715038,21:45:23 14 Oct 2020,https://docs.cdn.yougov.com/k5c8jvh4n7/tabs_HP_Coronavirus_20200911.pdf
2020-10-14,2020-09-07,2020-09-13,0,SurveyMonkey,D-,0,0.1761635,0.01504175,False,a,all,36654.0,62.0,28.0,7.0,3.0,57.572694,30.31194,8.3640505,3.2894735,21:45:20 14 Oct 2020,https://www.surveymonkey.com/curiosity/nbc-poll-covid-sept13/
2020-10-14,2020-09-10,2020-09-13,0,Morning Consult,B/C,0,0.37895246,0.04450856,False,a,all,2200.0,55.0,28.0,5.0,3.0,52.109742,31.503972,8.2688006,3.6497741,21:45:20 14 Oct 2020,https://assets.morningconsult.com/wp-uploads/2020/09/14102242/200943_crosstabs_CORONAVIRUS_CONTENT_Adults_v2_JB.pdf
2020-10-14,2020-09-11,2020-09-13,1,Léger,,0,0.35352565,0.0347369,False,a,all,1001.0,27.0,33.0,20.0,16.0,30.820666,32.464003,20.321945,13.301862,21:45:23 14 Oct 2020,https://leger360.com/wp-content/uploads/2020/09/Sondage-hebdomadaire-de-Le%CC%81ger-13-septembre-2020.pdf
2020-10-14,2020-09-10,2020-09-12,0,Harris Insights & Analytics,C,0,0.42132384,0.04998332,False,a,all,2037.0,48.0,37.0,9.0,6.0,50.148549,34.831347,8.931115,5.0396212,21:45:20 14 Oct 2020,https://theharrispoll.com/wp-content/uploads/2020/09/Binder2.pdf
2020-10-14,2020-09-03,2020-09-08,1,Monmouth University,A+,0,1.9304989,0.13911215,False,a,all,867.0,47.0,27.0,13.0,12.0,41.905941,29.893968,15.482392,10.90665,21:45:23 14 Oct 2020,https://www.monmouth.edu/polling-institute/documents/monmouthpoll_us_090920.pdf/
2020-10-14,2020-09-06,2020-09-08,1,YouGov,B,0,0.35647135,0.01713982,False,a,all,1500.0,21.0,37.0,26.0,16.0,25.450464,34.378439,23.721761,15.715038,21:45:23 14 Oct 2020,https://docs.cdn.yougov.com/8nwf5tw7g2/econTabReport.pdf
2020-10-14,2020-08-31,2020-09-06,0,SurveyMonkey,D-,0,0.17437957,0.00677685,False,a,all,35847.0,61.0,28.0,7.0,3.0,56.572694,30.31194,8.3640505,3.2894735,21:45:20 14 Oct 2020,https://www.surveymonkey.com/curiosity/nbc-poll-covid-sept6/
2020-10-14,2020-09-02,2020-09-06,0,Morning Consult,B/C,0,0.37807428,0.01769265,False,a,all,2200.0,55.0,30.0,6.0,2.0,52.109742,33.503972,9.2688006,2.6497741,21:45:20 14 Oct 2020,https://assets.morningconsult.com/wp-uploads/2020/09/08124344/200903_crosstabs_CORONAVIRUS_CONTENT_Adults_v2_JB.pdf
2020-10-14,2020-09-04,2020-09-06,1,Léger,,0,0.32949379,0.01628375,False,a,all,1001.0,27.0,35.0,18.0,17.0,30.820666,34.464003,18.321945,14.301862,21:45:23 14 Oct 2020,https://leger360.com/wp-content/uploads/2020/09/Sondage-hebdomadaire-de-Leger-8-septembre-2020.pdf
2020-10-14,2020-09-03,2020-09-05,0,Harris Insights & Analytics,C,0,0.39690985,0.02098003,False,a,all,2022.0,47.0,36.0,11.0,5.0,49.148549,33.831347,10.931115,4.0396212,21:45:20 14 Oct 2020,https://theharrispoll.com/wp-content/uploads/2020/09/Wave-28-Data-Tabs.pdf
2020-10-14,2020-09-02,2020-09-04,1,YouGov,B,0,0.55363656,0.01751201,False,rv,all,2493.0,30.0,38.0,21.0,11.0,34.450464,35.378439,18.721761,10.715038,21:45:23 14 Oct 2020,https://drive.google.com/file/d/1hmvwY-EJIMWKveUWPTdpx_-JL6VTqCcx/view
2020-10-14,2020-08-30,2020-09-01,1,YouGov,B,0,0.32347059,0.00592958,False,a,all,1500.0,20.0,40.0,26.0,14.0,24.450464,37.378439,23.721761,13.715038,21:45:23 14 Oct 2020,https://docs.cdn.yougov.com/7kvpozbozh/econTabReport.pdf
2020-10-14,2020-09-01,2020-09-01,1,Data for Progress,B-,0,0.73689874,0.02028532,False,a,all,806.0,30.63,33.9,22.16,12.41,30.478019,32.838534,22.454531,12.556414,21:45:23 14 Oct 2020,https://docs.google.com/spreadsheets/d/1Usnyhw8rNPQbRxmTBsxEC09KULamI_bNGaFaQJPdIPE/edit
2020-10-14,2020-08-28,2020-08-31,0,Morning Consult,B/C,0,0.37573236,0.00969531,False,a,all,2200.0,56.0,29.0,5.0,3.0,53.109742,32.503972,8.2688006,3.6497741,21:45:20 14 Oct 2020,https://assets.morningconsult.com/wp-uploads/2020/08/31125104/2008107_crosstabs_CORONAVIRUS_CONTENT_Adults_v2_JB.pdf
2020-10-14,2020-08-24,2020-08-31,1,Ipsos,B-,0,1.4248292,0.00943166,False,a,all,1929.0,19.0,41.0,27.0,12.0,18.706481,37.438749,27.801208,14.206017,21:45:23 14 Oct 2020,https://www.washingtonpost.com/context/washington-post-university-of-maryland-poll-by-ipsos-on-voting-issues-aug-24-31/d0ca1dc3-4b85-40b1-92b1-4c91986d0be3/
2020-10-14,2020-08-27,2020-08-31,1,Global Strategy Group/GBAO/Navigator Research,,0,0.62927196,0.00644382,False,rv,all,1309.0,37.0,31.5,22.0,9.5,33.48797,32.949109,21.447611,10.618814,21:45:23 14 Oct 2020,https://navigatorresearch.org/wp-content/uploads/2020/09/Navigating-Coronavirus-Full-Topline-F09.01.20.pdf
2020-10-14,2020-08-28,2020-08-31,1,Quinnipiac University,B+,0,1.6115291,0.03503324,False,lv,all,1081.0,42.0,32.0,15.0,11.0,37.369745,32.77448,17.721292,11.090469,21:45:23 14 Oct 2020,https://poll.qu.edu/national/release-detail?ReleaseID=3671
2020-10-14,2020-08-24,2020-08-30,0,SurveyMonkey,D-,0,0.17858638,0.00211216,False,a,all,37386.0,63.0,27.0,7.0,3.0,58.572694,29.31194,8.3640505,3.2894735,21:45:20 14 Oct 2020,https://www.surveymonkey.com/curiosity/nbc-poll-covid-aug30/
2020-10-14,2020-08-28,2020-08-30,0,Harris Insights & Analytics,C,0,0.37758719,0.0087128,False,a,all,1946.0,48.0,35.0,11.0,6.0,50.148549,32.831347,10.931115,5.0396212,21:45:20 14 Oct 2020,https://theharrispoll.com/wp-content/uploads/2020/09/Wave-27_tabs_Banner-1.pdf
2020-10-14,2020-08-17,2020-08-30,1,Gallup,B,0,1.117133,0.0,False,a,all,2714.0,12.0,41.0,31.0,16.0,26.983621,36.097817,21.889916,13.378007,21:45:23 14 Oct 2020,https://news.gallup.com/poll/308222/coronavirus-pandemic.aspx
2020-10-14,2020-08-28,2020-08-30,1,Léger,,0,0.32642327,0.0034684,False,a,all,1003.0,26.0,35.0,20.0,16.0,29.820666,34.464003,20.321945,13.301862,21:45:23 14 Oct 2020,https://leger360.com/wp-content/uploads/2020/08/Legers-Weekly-Survey-august-31st-2020.pdf
2020-10-14,2020-08-27,2020-08-29,1,YouGov,B,0,0.21313915,0.00098148,False,a,all,1000.0,31.0,37.0,19.0,10.0,35.450464,34.378439,16.721761,9.715038,21:45:23 14 Oct 2020,https://docs.cdn.yougov.com/k5f6mc1kum/tabs_HP_Coronavirus_20200827.pdf
2020-10-14,2020-08-18,2020-08-28,1,University of Maryland,B/C,0,1.8862329,0.0,False,a,all,3932.0,37.0,35.0,17.0,10.0,35.583833,34.632955,17.731188,10.501532,21:45:23 14 Oct 2020,https://criticalissues.umd.edu/sites/criticalissues.umd.edu/files/UMCIP%20August%202020%20Poll%20Questionnaire.pdf
2020-10-14,2020-08-23,2020-08-25,1,YouGov,B,0,0.30989948,0.0,False,a,all,1500.0,21.0,37.0,28.0,14.0,25.450464,34.378439,25.721761,13.715038,21:45:23 14 Oct 2020,https://docs.cdn.yougov.com/sqqliantmw/econTabReport.pdf
2020-10-14,2020-08-21,2020-08-24,0,Ipsos,B-,0,0.66228987,0.0,False,a,all,1084.0,52.0,34.0,9.0,4.0,52.262696,34.058454,9.0182577,3.5279595,21:45:20 14 Oct 2020,https://www.ipsos.com/sites/default/files/ct/news/documents/2020-08/topline-axios-w22.pdf
2020-10-14,2020-08-17,2020-08-23,0,SurveyMonkey,D-,0,0.19745705,0.0,False,a,all,42315.0,64.0,27.0,6.0,3.0,59.572694,29.31194,7.3640505,3.2894735,21:45:20 14 Oct 2020,https://www.surveymonkey.com/curiosity/nbc-poll-covid-aug23/
2020-10-14,2020-08-21,2020-08-23,0,Morning Consult,B/C,0,0.38301327,0.0,False,a,all,2200.0,57.0,27.0,5.0,3.0,54.109742,30.503972,8.2688006,3.6497741,21:45:20 14 Oct 2020,https://assets.morningconsult.com/wp-uploads/2020/08/24113947/200878_crosstabs_CORONAVIRUS_CONTENT_Adults_v2_JB.pdf
2020-10-14,2020-08-21,2020-08-23,0,Harris Insights & Analytics,C,0,0.38391175,0.0,False,a,all,1962.0,54.0,32.0,10.0,4.0,56.148549,29.831347,9.931115,3.0396212,21:45:20 14 Oct 2020,https://theharrispoll.com/wp-content/uploads/2020/08/data-tabs_w26.pdf
2020-10-14,2020-08-21,2020-08-23,1,Léger,,0,0.33999492,0.0,False,a,all,1003.0,25.0,36.0,17.0,16.0,28.820666,35.464003,17.321945,13.301862,21:45:23 14 Oct 2020,https://projects.fivethirtyeight.com/polls/20200824_National.pdf
2020-10-14,2020-08-20,2020-08-22,1,YouGov,B,0,0.2041496,0.0,False,a,all,1000.0,37.0,33.0,19.0,8.0,41.450464,30.378439,16.721761,7.715038,21:45:23 14 Oct 2020,https://docs.cdn.yougov.com/d0176c71yw/tabs_HP_Coronavirus_20200820.pdf
2020-10-14,2020-08-19,2020-08-21,1,YouGov,B,0,0.45382607,0.0,False,rv,all,2226.0,32.0,36.0,20.0,12.0,36.450464,33.378439,17.721761,11.715038,21:45:23 14 Oct 2020,https://drive.google.com/file/d/11UTgWRN1SvFmO3W9PVVOnPyGYqea4X6H/view
2020-10-14,2020-08-17,2020-08-19,1,AP-NORC,,0,1.3208226,0.0,False,a,all,1075.0,42.0,31.0,17.0,9.0,38.516904,31.979967,17.091302,10.432568,21:45:23 14 Oct 2020,https://apnorc.org/wp-content/uploads/2020/08/August-Topline-trump-1.pdf
2020-10-14,2020-08-14,2020-08-18,1,Echelon Insights,,0,0.73932373,0.0,False,rv,all,1000.0,49.0,29.0,20.0,2.0,39.860174,32.126997,19.73578,6.8683142,21:45:23 14 Oct 2020,https://echeloninsights.com/in-the-news/september-omnibus-covid/
2020-10-14,2020-08-16,2020-08-18,1,YouGov,B,0,0.31364061,0.0,False,a,all,1500.0,26.0,37.0,23.0,14.0,30.450464,34.378439,20.721761,13.715038,21:45:23 14 Oct 2020,https://docs.cdn.yougov.com/c6n58wb53l/econTabReport.pdf
2020-10-14,2020-08-14,2020-08-17,0,Ipsos,B-,0,0.57967875,0.0,False,a,all,1141.0,56.0,32.0,7.0,4.0,56.262696,32.058454,7.0182577,3.5279595,21:45:20 14 Oct 2020,https://www.ipsos.com/sites/default/files/ct/news/documents/2020-08/topline-axios-w21.pdf
2020-10-14,2020-08-14,2020-08-17,0,Morning Consult,B/C,0,0.39463666,0.0,False,a,all,2200.0,61.0,25.0,5.0,2.0,58.109742,28.503972,8.2688006,2.6497741,21:45:20 14 Oct 2020,https://assets.morningconsult.com/wp-uploads/2020/08/17130704/200822_crosstabs_CORONAVIRUS_CONTENT_Adults_v2_JB.pdf
2020-10-14,2020-08-14,2020-08-17,1,YouGov,B,0,0.2114051,0.0,False,a,all,1000.0,36.0,34.0,18.0,7.0,40.450464,31.378439,15.721761,6.715038,21:45:23 14 Oct 2020,https://docs.cdn.yougov.com/atqbvkhvpc/tabs_HP_Coronavirus_20200814.pdf
2020-10-14,2020-08-10,2020-08-16,0,SurveyMonkey,D-,0,0.15691315,0.0,False,a,all,34269.0,65.0,25.0,6.0,3.0,60.572694,27.31194,7.3640505,3.2894735,21:45:20 14 Oct 2020,https://www.surveymonkey.com/curiosity/nbc-poll-covid-aug16/
2020-10-14,2020-08-14,2020-08-16,0,Harris Insights & Analytics,C,0,0.38879514,0.0,False,a,all,1967.0,50.0,37.0,8.0,4.0,52.148549,34.831347,7.931115,3.0396212,21:45:20 14 Oct 2020,https://theharrispoll.com/wp-content/uploads/2020/08/COVID-Tracker-W25-Banner-1.pdf
2020-10-14,2020-08-10,2020-08-16,1,Gallup,B,0,1.0630818,0.0,False,a,all,4000.0,16.0,43.0,26.0,15.0,30.983621,38.097817,16.889916,12.378007,21:45:23 14 Oct 2020,https://news.gallup.com/poll/308222/coronavirus-pandemic.aspx
2020-10-14,2020-08-14,2020-08-16,1,Léger,,0,0.39171986,0.0,False,a,all,1001.0,27.0,37.0,19.0,13.0,30.820666,36.464003,19.321945,10.301862,21:45:23 14 Oct 2020,https://leger360.com/wp-content/uploads/2020/08/Legers-Weekly-Survey-august-17th-2020.pdf
2020-10-14,2020-08-12,2020-08-15,1,ABC News/The Washington Post,A+,0,2.1010421,0.0,False,a,all,1001.0,31.0,34.0,15.0,14.0,34.241627,33.513427,14.403735,12.150696,21:45:23 14 Oct 2020,https://www.washingtonpost.com/context/washington-post-abc-news-poll-aug-12-15-2020/b16f1e30-c98f-4b77-ba12-9d4f0baddceb//
2020-10-14,2020-08-09,2020-08-11,1,YouGov,B,0,0.33785924,0.0,False,a,all,1500.0,28.0,40.0,21.0,12.0,32.450464,37.378439,18.721761,11.715038,21:45:23 14 Oct 2020,https://docs.cdn.yougov.com/horeovzt7u/econTabReport.pdf
2020-10-14,2020-08-11,2020-08-11,1,Data for Progress,B-,0,0.766651,0.0,False,a,all,934.0,34.86,33.17,17.12,13.02,34.708019,32.108534,17.414531,13.166414,21:45:23 14 Oct 2020,https://docs.google.com/spreadsheets/d/15vLWWtDTbkaYhydkV_HV8A1n5VlR8J6KQ8Nb6bs6_wM/edit#gid=0
2020-10-14,2020-08-05,2020-08-10,0,Morning Consult,B/C,0,0.39614563,0.0,False,a,all,2200.0,61.0,27.0,4.0,2.0,58.109742,30.503972,7.2688006,2.6497741,21:45:20 14 Oct 2020,https://assets.morningconsult.com/wp-uploads/2020/08/20105707/200805_crosstabs_CORONAVIRUS_CONTENT_Adults_v2_JB.pdf
2020-10-14,2020-08-07,2020-08-10,0,Ipsos,B-,0,0.50846094,0.0,False,a,all,1076.0,58.0,29.0,8.0,4.0,58.262696,29.058454,8.0182577,3.5279595,21:45:20 14 Oct 2020,https://www.ipsos.com/sites/default/files/ct/news/documents/2020-08/topline-axios-w20.pdf
2020-10-14,2020-08-06,2020-08-10,1,Monmouth University,A+,0,1.9309651,0.0,False,a,all,868.0,41.0,28.0,18.0,13.0,35.905941,30.893968,20.482392,11.90665,21:45:23 14 Oct 2020,https://www.monmouth.edu/polling-institute/documents/monmouthpoll_us_081320.pdf/
2020-10-14,2020-08-07,2020-08-10,1,YouGov,B,0,0.22809944,0.0,False,a,all,1000.0,38.0,35.0,16.0,9.0,42.450464,32.378439,13.721761,8.715038,21:45:23 14 Oct 2020,https://docs.cdn.yougov.com/als02392pz/tabs_HP_Coronavirus_20200807.pdf
2020-10-14,2020-08-03,2020-08-09,0,SurveyMonkey,D-,0,0.19204796,0.0,False,a,all,44601.0,68.0,24.0,5.0,2.0,63.572694,26.31194,6.3640505,2.2894735,21:45:20 14 Oct 2020,https://www.surveymonkey.com/curiosity/nbc-poll-covid-aug9/
2020-10-14,2020-08-07,2020-08-09,0,Harris Insights & Analytics,C,0,0.39318084,0.0,False,a,all,1995.0,53.0,34.0,9.0,4.0,55.148549,31.831347,8.931115,3.0396212,21:45:20 14 Oct 2020,https://theharrispoll.com/wp-content/uploads/2020/08/COVID-Data-tabs_w24.pdf
2020-10-14,2020-08-03,2020-08-09,1,Gallup,B,0,0.87017022,0.0,False,a,all,3752.0,11.0,44.0,30.0,15.0,25.983621,39.097817,20.889916,12.378007,21:45:23 14 Oct 2020,https://news.gallup.com/poll/308222/coronavirus-pandemic.aspx
2020-10-14,2020-08-02,2020-08-04,1,YouGov,B,0,0.349809,0.0,False,a,all,1500.0,25.0,40.0,23.0,12.0,29.450464,37.378439,20.721761,11.715038,21:45:23 14 Oct 2020,https://docs.cdn.yougov.com/t0qsgk3wcg/econTabReport.pdf
2020-10-14,2020-07-30,2020-08-03,0,Global Strategy Group/GBAO/Navigator Research,,0,0.67979014,0.0,False,rv,all,1407.0,44.0,38.0,14.0,4.0,51.314852,32.419535,12.251029,3.0680561,21:45:20 14 Oct 2020,https://navigatorresearch.org/wp-content/uploads/2020/08/Navigating-Coronavirus-Topline-08.04.20.pdf
2020-10-14,2020-07-31,2020-08-03,0,Ipsos,B-,0,0.52020672,0.0,False,a,all,1129.0,59.0,29.0,8.0,4.0,59.262696,29.058454,8.0182577,3.5279595,21:45:20 14 Oct 2020,https://www.ipsos.com/sites/default/files/ct/news/documents/2020-08/topline-axios-wave-19.pdf
2020-10-14,2020-07-30,2020-08-03,1,Global Strategy Group/GBAO/Navigator Research,,0,0.64678877,0.0,False,rv,all,1407.0,42.0,34.0,17.0,7.0,38.48797,35.449109,16.447611,8.1188139,21:45:23 14 Oct 2020,https://navigatorresearch.org/wp-content/uploads/2020/08/Navigating-Coronavirus-Topline-08.04.20.pdf
2020-10-14,2020-07-31,2020-08-03,1,YouGov,B,0,0.23181171,0.0,False,a,all,1000.0,38.0,31.0,17.0,10.0,42.450464,28.378439,14.721761,9.715038,21:45:23 14 Oct 2020,https://big.assets.huffingtonpost.com/athena/files/2020/08/04/5f29e971c5b656e9b0a17c7e.pdf
2020-10-14,2020-07-27,2020-08-02,0,SurveyMonkey,D-,0,0.19339417,0.0,False,a,all,47190.0,67.0,25.0,5.0,2.0,62.572694,27.31194,6.3640505,2.2894735,21:45:20 14 Oct 2020,https://www.surveymonkey.com/curiosity/nbc-poll-covid-aug2/
2020-10-14,2020-07-31,2020-08-02,0,Morning Consult,B/C,0,0.39865524,0.0,False,a,all,2200.0,62.0,25.0,4.0,2.0,59.109742,28.503972,7.2688006,2.6497741,21:45:20 14 Oct 2020,https://assets.morningconsult.com/wp-uploads/2020/08/04113557/2007121_crosstabs_CORONAVIRUS_CONTENT_Adults_v2_JB.pdf
2020-10-14,2020-07-31,2020-08-02,0,Harris Insights & Analytics,C,0,0.393246,0.0,False,a,all,1992.0,52.0,35.0,9.0,4.0,54.148549,32.831347,8.931115,3.0396212,21:45:20 14 Oct 2020,https://theharrispoll.com/wp-content/uploads/2020/08/Binder3.pdf
2020-10-14,2020-07-27,2020-08-02,1,Gallup,B,0,0.82906257,0.0,False,a,all,3816.0,12.0,46.0,27.0,14.0,26.983621,41.097817,17.889916,11.378007,21:45:23 14 Oct 2020,https://news.gallup.com/poll/308222/coronavirus-pandemic.aspx
2020-10-14,2020-07-28,2020-08-02,1,Garin-Hart-Yang Research Group,B/C,0,1.6462707,0.0,False,a,all,2043.0,37.0,43.0,13.0,7.0,33.415132,42.655833,14.302753,8.7517259,21:45:23 14 Oct 2020,https://static1.squarespace.com/static/5f3ef72a9ef74c6c995e6ab6/t/5f3f1a1ab6b900366e9d3b62/1597970981462/COVIDCollab_8.20_FullReport.pdf
2020-10-14,2020-07-24,2020-07-28,1,Optimus,B/C,1,0.8982327,0.0,False,a,all,1039.0,28.4,35.3,22.1,11.2,31.143239,33.430713,20.626173,11.394184,21:45:23 14 Oct 2020,https://github.com/optimus-forecasting-and-polling/0ptimus-Coronavirus-Tracking/tree/master/July-29-2020
2020-10-14,2020-07-26,2020-07-28,1,YouGov,B,0,0.33260488,0.0,False,a,all,1500.0,24.0,39.0,26.0,11.0,28.450464,36.378439,23.721761,10.715038,21:45:23 14 Oct 2020,https://docs.cdn.yougov.com/0nx7ztz02j/econTabReport.pdf
2020-10-14,2020-07-28,2020-07-28,1,Data for Progress,B-,0,0.67907818,0.0,False,a,all,948.0,34.82,35.11,18.69,9.41,34.668019,34.048534,18.984531,9.5564142,21:45:23 14 Oct 2020,https://docs.google.com/spreadsheets/d/1vHJwLq-J0-yclcutHLNjwhQu2YEqYW1R9J-mMBvwXo0/edit#gid=0
2020-10-14,2020-07-24,2020-07-27,0,Ipsos,B-,0,0.50021237,0.0,False,a,all,1076.0,58.0,30.0,9.0,2.0,58.262696,30.058454,9.0182577,1.5279595,21:45:20 14 Oct 2020,https://www.ipsos.com/sites/default/files/ct/news/documents/2020-07/topline-axios-w18.pdf
2020-10-14,2020-07-24,2020-07-27,1,YouGov,B,0,0.22061721,0.0,False,a,all,1000.0,38.0,33.0,17.0,9.0,42.450464,30.378439,14.721761,8.715038,21:45:23 14 Oct 2020,https://docs.cdn.yougov.com/qug77u6dcr/tabs_HP_Coronavirus_20200724.pdf
2020-10-14,2020-07-20,2020-07-26,0,SurveyMonkey,D-,0,0.18729785,0.0,False,a,all,46450.0,66.0,26.0,5.0,2.0,61.572694,28.31194,6.3640505,2.2894735,21:45:20 14 Oct 2020,https://www.surveymonkey.com/curiosity/nbc-poll-covid-july26/
2020-10-14,2020-07-23,2020-07-26,0,Morning Consult,B/C,0,0.39527252,0.0,False,a,all,2200.0,59.0,28.0,4.0,2.0,56.109742,31.503972,7.2688006,2.6497741,21:45:20 14 Oct 2020,https://assets.morningconsult.com/wp-uploads/2020/07/29174441/200781_crosstabs_CORONAVIRUS_CONTENT_Adults_v2_JB.pdf
2020-10-14,2020-07-24,2020-07-26,0,Harris Insights & Analytics,C,0,0.3892763,0.0,False,a,all,1988.0,51.0,34.0,11.0,4.0,53.148549,31.831347,10.931115,3.0396212,21:45:20 14 Oct 2020,https://theharrispoll.com/wp-content/uploads/2020/07/Wave-22_Tabs.pdf
2020-10-14,2020-07-20,2020-07-26,1,Gallup,B,0,0.81245805,0.0,False,a,all,3816.0,15.0,44.0,28.0,13.0,29.983621,39.097817,18.889916,10.378007,21:45:23 14 Oct 2020,https://news.gallup.com/poll/308222/coronavirus-pandemic.aspx
2020-10-14,2020-07-24,2020-07-26,1,Léger,,0,0.39119825,0.0,False,a,all,1004.0,30.0,34.0,15.0,16.0,33.820666,33.464003,15.321945,13.301862,21:45:23 14 Oct 2020,https://leger360.com/wp-content/uploads/2020/07/Legers-Weekly-Survey-July-27-2020.pdf
2020-10-14,2020-07-21,2020-07-24,1,YouGov,B,0,0.43962018,0.0,False,a,all,2008.0,35.0,37.0,17.0,11.0,39.450464,34.378439,14.721761,10.715038,21:45:23 14 Oct 2020,https://drive.google.com/file/d/1p7C6oD2-2d0TNMlFQADlMQV9bBkNXQ35/view
2020-10-14,2020-07-22,2020-07-23,1,Ipsos,B-,0,0.71709452,0.0,False,a,all,543.0,37.0,40.0,17.0,6.0,36.706481,36.438749,17.801208,8.206017,21:45:23 14 Oct 2020,https://www.ipsos.com/sites/default/files/ct/news/documents/2020-07/topline-abc-wave16-072420.pdf
2020-10-14,2020-07-17,2020-07-22,1,Echelon Insights,,0,0.73766194,0.0,False,rv,all,1000.0,51.0,28.0,20.0,1.0,41.860174,31.126997,19.73578,5.8683142,21:45:23 14 Oct 2020,https://echeloninsights.com/in-the-news/september-omnibus-covid/
2020-10-14,2020-07-19,2020-07-21,1,YouGov,B,0,0.33179284,0.0,False,a,all,1500.0,26.0,38.0,25.0,11.0,30.450464,35.378439,22.721761,10.715038,21:45:23 14 Oct 2020,https://docs.cdn.yougov.com/8uw05wqpg2/econTabReport.pdf
2020-10-14,2020-07-21,2020-07-21,1,Data for Progress,B-,0,0.56593409,0.0,False,a,all,780.0,32.71,34.74,20.36,10.15,32.558019,33.678534,20.654531,10.296414,21:45:23 14 Oct 2020,https://docs.google.com/spreadsheets/d/1a_8Vk2KGs5CZ51Rcyu8WChFIErQ1US9DNk9fcuuGvME/edit
2020-10-14,2020-07-16,2020-07-20,0,Global Strategy Group/GBAO/Navigator Research,,0,0.40264633,0.0,False,rv,all,1015.0,48.0,37.0,13.0,2.0,55.314852,31.419535,11.251029,1.0680561,21:45:20 14 Oct 2020,https://navigatorresearch.org/wp-content/uploads/2020/07/Navigating-Coronavirus-Full-Topline-07.21.20.pdf
2020-10-14,2020-07-17,2020-07-20,0,Ipsos,B-,0,0.50145138,0.0,False,a,all,1037.0,52.0,33.0,10.0,3.0,52.262696,33.058454,10.018258,2.5279595,21:45:20 14 Oct 2020,https://www.ipsos.com/sites/default/files/ct/news/documents/2020-07/axios-ipsos-poll-w17.pdf
2020-10-14,2020-07-16,2020-07-20,1,AP-NORC,,0,1.3556087,0.0,False,a,all,1057.0,49.0,31.0,11.0,8.0,45.516904,31.979967,11.091302,9.4325683,21:45:23 14 Oct 2020,https://apnorc.org/wp-content/uploads/2020/07/topline_release2.pdf
2020-10-14,2020-07-16,2020-07-20,1,Global Strategy Group/GBAO/Navigator Research,,0,0.40065094,0.0,False,rv,all,1015.0,47.0,32.0,15.0,6.0,43.48797,33.449109,14.447611,7.1188139,21:45:23 14 Oct 2020,https://navigatorresearch.org/wp-content/uploads/2020/07/Navigating-Coronavirus-Full-Topline-07.21.20.pdf
2020-10-14,2020-07-13,2020-07-19,0,SurveyMonkey,D-,0,0.20558963,0.0,False,a,all,50404.0,66.0,25.0,6.0,2.0,61.572694,27.31194,7.3640505,2.2894735,21:45:20 14 Oct 2020,https://www.surveymonkey.com/curiosity/nbc-poll-covid-july19/
2020-10-14,2020-07-17,2020-07-19,0,Harris Insights & Analytics,C,0,0.38814722,0.0,False,a,all,1970.0,57.0,32.0,6.0,4.0,59.148549,29.831347,5.931115,3.0396212,21:45:20 14 Oct 2020,https://theharrispoll.com/wp-content/uploads/2020/07/Wave-21_Banner-1.pdf
2020-10-14,2020-07-17,2020-07-19,0,Morning Consult,B/C,0,0.40544457,0.0,False,a,all,2200.0,61.0,26.0,4.0,2.0,58.109742,29.503972,7.2688006,2.6497741,21:45:20 14 Oct 2020,https://assets.morningconsult.com/wp-uploads/2020/07/24165334/200743_crosstabs_CORONAVIRUS_CONTENT_Adults_v2_JB.pdf
2020-10-14,2020-07-13,2020-07-19,1,Gallup,B,0,0.79451029,0.0,False,a,all,3745.0,16.0,43.0,28.0,13.0,30.983621,38.097817,18.889916,10.378007,21:45:23 14 Oct 2020,https://news.gallup.com/poll/308222/coronavirus-pandemic.aspx
2020-10-14,2020-07-17,2020-07-19,1,YouGov,B,0,0.22587944,0.0,False,a,all,1000.0,37.0,34.0,16.0,9.0,41.450464,31.378439,13.721761,8.715038,21:45:23 14 Oct 2020,https://docs.cdn.yougov.com/q175vngukj/tabs_HP_Coronavirus_20200717.pdf
2020-10-14,2020-07-17,2020-07-19,1,Léger,,0,0.33567399,0.0,False,a,all,1004.0,27.0,34.0,18.0,17.0,30.820666,33.464003,18.321945,14.301862,21:45:23 14 Oct 2020,https://leger360.com/wp-content/uploads/2020/07/Legers-Weekly-Survey-July-20-2020.pdf
2020-10-14,2020-07-12,2020-07-15,1,ABC News/The Washington Post,A+,0,2.1173709,0.0,False,a,all,1006.0,33.0,33.0,17.0,12.0,36.241627,32.513427,16.403735,10.150696,21:45:23 14 Oct 2020,https://docs.google.com/spreadsheets/d/1v1clZFRQX3VBvmMLwv26Pzgv7wb19phCHTABTQ-HRtU/edit
2020-10-14,2020-07-12,2020-07-14,1,YouGov,B,0,0.3483512,0.0,False,a,all,1500.0,24.0,40.0,26.0,11.0,28.450464,37.378439,23.721761,10.715038,21:45:23 14 Oct 2020,https://docs.cdn.yougov.com/hpupr0zhkl/econTabReport.pdf
2020-10-14,2020-07-09,2020-07-13,0,Global Strategy Group/GBAO/Navigator Research,,0,0.37352124,0.0,False,rv,all,1002.0,47.0,39.0,10.0,4.0,54.314852,33.419535,8.2510295,3.0680561,21:45:20 14 Oct 2020,https://navigatorresearch.org/wp-content/uploads/2020/07/Navigating-Coronavirus-Full-Topline-07.14.20.pdf
2020-10-14,2020-07-10,2020-07-13,0,Ipsos,B-,0,0.56338179,0.0,False,a,all,1063.0,52.0,32.0,10.0,3.0,52.262696,32.058454,10.018258,2.5279595,21:45:20 14 Oct 2020,https://www.ipsos.com/sites/default/files/ct/news/documents/2020-07/topline-axios-poll-w16.pdf
2020-10-14,2020-07-09,2020-07-13,1,Quinnipiac University,B+,0,1.6827947,0.0,False,rv,all,1273.0,48.0,31.0,12.0,9.0,43.369745,31.77448,14.721292,9.0904689,21:45:23 14 Oct 2020,https://poll.qu.edu/national/release-detail?ReleaseID=3666
2020-10-14,2020-07-09,2020-07-13,1,Global Strategy Group/GBAO/Navigator Research,,0,0.37352124,0.0,False,rv,all,1002.0,46.0,30.0,15.0,9.0,42.48797,31.449109,14.447611,10.118814,21:45:23 14 Oct 2020,https://navigatorresearch.org/wp-content/uploads/2020/07/Navigating-Coronavirus-Full-Topline-07.14.20.pdf
2020-10-14,2020-07-06,2020-07-12,0,SurveyMonkey,D-,0,0.23689474,0.0,False,a,all,53106.0,64.0,27.0,6.0,2.0,59.572694,29.31194,7.3640505,2.2894735,21:45:20 14 Oct 2020,https://www.surveymonkey.com/curiosity/nbc-poll-covid-july12/
2020-10-14,2020-07-10,2020-07-12,0,Harris Insights & Analytics,C,0,0.37153991,0.0,False,a,all,1974.0,50.0,36.0,9.0,5.0,52.148549,33.831347,8.931115,4.0396212,21:45:20 14 Oct 2020,https://theharrispoll.com/wp-content/uploads/2020/07/Wave-20_tabs_Banner-1.pdf
2020-10-14,2020-07-09,2020-07-12,0,Morning Consult,B/C,0,0.37168208,0.0,False,rv,all,1991.0,60.0,28.0,4.0,3.0,57.109742,31.503972,7.2688006,3.6497741,21:45:20 14 Oct 2020,https://assets.morningconsult.com/wp-uploads/2020/07/14102450/200723_crosstabs_CORONAVIRUS_CONTENT_RVs_v2_JB.pdf
2020-10-14,2020-07-06,2020-07-12,1,Gallup,B,0,0.77352653,0.0,False,a,all,3612.0,14.0,39.0,31.0,16.0,28.983621,34.097817,21.889916,13.378007,21:45:23 14 Oct 2020,https://news.gallup.com/poll/308222/coronavirus-pandemic.aspx
2020-10-14,2020-07-10,2020-07-12,1,Léger,,0,0.31426293,0.0,False,a,all,1001.0,26.0,35.0,19.0,16.0,29.820666,34.464003,19.321945,13.301862,21:45:23 14 Oct 2020,https://leger360.com/wp-content/uploads/2020/07/Legers-Weekly-Survey-July-13-2020-1.pdf
2020-10-14,2020-07-10,2020-07-12,1,YouGov,B,0,0.23746759,0.0,False,a,all,1000.0,38.0,34.0,15.0,10.0,42.450464,31.378439,12.721761,9.715038,21:45:23 14 Oct 2020,https://docs.cdn.yougov.com/83fwc1fiim/tabs_HP_Coronavirus_20200710.pdf
2020-10-14,2020-07-05,2020-07-07,1,YouGov,B,0,0.34828403,0.0,False,a,all,1500.0,23.0,39.0,25.0,13.0,27.450464,36.378439,22.721761,12.715038,21:45:23 14 Oct 2020,https://docs.cdn.yougov.com/lraqqdhd7j/econTabReport.pdf
2020-10-14,2020-07-07,2020-07-07,1,Data for Progress,B-,0,0.64254475,0.0,False,a,all,790.0,34.67,36.16,16.62,11.32,34.518019,35.098534,16.914531,11.466414,21:45:23 14 Oct 2020,https://docs.google.com/spreadsheets/d/1uArOeLkRvJ-QkYPhu97acZx426SFgU0wAwu0jfF7ABg/edit
2020-10-14,2020-07-03,2020-07-06,1,YouGov,B,0,0.23085704,0.0,False,a,all,1000.0,35.0,36.0,15.0,10.0,39.450464,33.378439,12.721761,9.715038,21:45:23 14 Oct 2020,https://docs.cdn.yougov.com/t8umayhzsr/tabs_HP_Coronavirus_20200703.pdf
2020-10-14,2020-06-29,2020-07-05,0,SurveyMonkey,D-,0,0.26206536,0.0,False,a,all,44557.0,65.0,26.0,6.0,2.0,60.572694,28.31194,7.3640505,2.2894735,21:45:20 14 Oct 2020,https://www.surveymonkey.com/curiosity/nbc-poll-covid-july5/
2020-10-14,2020-06-29,2020-07-05,1,Gallup,B,0,0.77858292,0.0,False,a,all,3615.0,12.0,42.0,30.0,15.0,26.983621,37.097817,20.889916,12.378007,21:45:23 14 Oct 2020,https://news.gallup.com/poll/308222/coronavirus-pandemic.aspx
2020-10-14,2020-07-03,2020-07-05,1,Léger,,0,0.30599218,0.0,False,a,all,1006.0,24.0,36.0,21.0,15.0,27.820666,35.464003,21.321945,12.301862,21:45:23 14 Oct 2020,https://leger360.com/wp-content/uploads/2020/07/Legers-Weekly-Survey-July-6-2020-1.pdf
2020-10-14,2020-07-02,2020-07-04,0,Harris Insights & Analytics,C,0,0.34456588,0.0,False,a,all,1957.0,54.0,34.0,8.0,4.0,56.148549,31.831347,7.931115,3.0396212,21:45:20 14 Oct 2020,https://theharrispoll.com/wp-content/uploads/2020/07/Wave-19_tabs_Banner-1.pdf
2020-10-14,2020-07-01,2020-07-04,0,Morning Consult,B/C,0,0.40680219,0.0,False,a,all,2200.0,59.0,27.0,5.0,2.0,56.109742,30.503972,8.2688006,2.6497741,21:45:20 14 Oct 2020,https://assets.morningconsult.com/wp-uploads/2020/07/24163951/2006143_crosstabs_CORONAVIRUS_CONTENT_Adults_v1_YW.pdf
2020-10-14,2020-06-25,2020-06-30,0,Global Strategy Group/GBAO/Navigator Research,,0,0.38793978,0.0,False,rv,all,1204.0,46.0,38.0,13.0,3.0,53.314852,32.419535,11.251029,2.0680561,21:45:20 14 Oct 2020,https://navigatorresearch.org/wp-content/uploads/2020/07/Navigating-Coronavirus-Full-Topline-F06.30.20.pdf
2020-10-14,2020-06-25,2020-06-30,1,Global Strategy Group/GBAO/Navigator Research,,0,0.38793978,0.0,False,rv,all,1204.0,37.0,32.0,20.5,10.5,33.48797,33.449109,19.947611,11.618814,21:45:23 14 Oct 2020,https://navigatorresearch.org/wp-content/uploads/2020/07/Navigating-Coronavirus-Full-Topline-F06.30.20.pdf
2020-10-14,2020-06-26,2020-06-30,1,Monmouth University,A+,0,1.929267,0.0,False,a,all,867.0,41.0,26.0,17.0,15.0,35.905941,28.893968,19.482392,13.90665,21:45:23 14 Oct 2020,https://www.monmouth.edu/polling-institute/documents/monmouthpoll_us_070120.pdf/
2020-10-14,2020-06-28,2020-06-30,1,YouGov,B,0,0.33092669,0.0,False,a,all,1500.0,22.0,43.0,3.0,12.0,26.450464,40.378439,0.72176126,11.715038,21:45:23 14 Oct 2020,https://docs.cdn.yougov.com/k05rp8ded6/econTabReport.pdf
2020-10-14,2020-06-25,2020-06-29,0,Morning Consult,B/C,0,0.36399277,0.0,False,rv,all,1986.0,61.0,25.0,4.0,3.0,58.109742,28.503972,7.2688006,3.6497741,21:45:20 14 Oct 2020,https://assets.morningconsult.com/wp-uploads/2020/06/30125522/2006114_crosstabs_CORONAVIRUS_CONTENT_RVs_v2_JB.pdf
2020-10-14,2020-06-26,2020-06-29,0,Harris Insights & Analytics,C,0,0.52752319,0.0,False,a,all,3161.0,56.0,31.0,8.0,5.0,58.148549,28.831347,7.931115,4.0396212,21:45:20 14 Oct 2020,https://theharrispoll.com/wp-content/uploads/2020/06/Wave-18_tabs_Banner-1.pdf
2020-10-14,2020-06-26,2020-06-29,0,Ipsos,B-,0,0.57417439,0.0,False,a,all,1065.0,54.0,33.0,9.0,3.0,54.262696,33.058454,9.0182577,2.5279595,21:45:20 14 Oct 2020,https://www.ipsos.com/sites/default/files/ct/news/documents/2020-06/topline_axios_ipsos_poll_w15_.pdf
2020-10-14,2020-06-26,2020-06-29,1,YouGov,B,0,0.21912634,0.0,False,a,all,1000.0,33.0,38.0,18.0,9.0,37.450464,35.378439,15.721761,8.715038,21:45:23 14 Oct 2020,https://docs.cdn.yougov.com/byy9drb31x/tabs_HP_Coronavirus_20200626.pdf
2020-10-14,2020-06-22,2020-06-28,1,Gallup,B,0,0.74327147,0.0,False,a,all,3454.0,12.0,44.0,30.0,15.0,26.983621,39.097817,20.889916,12.378007,21:45:23 14 Oct 2020,https://news.gallup.com/poll/308222/coronavirus-pandemic.aspx
2020-10-14,2020-06-26,2020-06-28,1,Léger,,0,0.30103436,0.0,False,a,all,1005.0,26.0,35.0,21.0,16.0,29.820666,34.464003,21.321945,13.301862,21:45:23 14 Oct 2020,https://leger360.com/wp-content/uploads/2020/06/Legers-Weekly-Survey-June-29-2020.pdf
2020-10-14,2020-06-23,2020-06-27,1,Optimus,B/C,1,0.60373905,0.0,False,a,all,999.0,23.1,39.3,21.8,13.8,25.843239,37.430713,20.326173,13.994184,21:45:23 14 Oct 2020,https://github.com/optimus-forecasting-and-polling/0ptimus-Coronavirus-Tracking/tree/master/June-29-2020
2020-10-14,2020-06-23,2020-06-26,1,YouGov,B,0,0.43739618,0.0,False,a,all,2009.0,34.0,37.0,17.0,11.0,38.450464,34.378439,14.721761,10.715038,21:45:23 14 Oct 2020,https://drive.google.com/file/d/1l0XruPxbVV8mBoT0mpmeLk4AmbnkIGeH/view
2020-10-14,2020-06-24,2020-06-25,1,Ipsos,B-,0,0.66822071,0.0,False,a,all,579.0,34.0,43.0,19.0,5.0,33.706481,39.438749,19.801208,7.206017,21:45:23 14 Oct 2020,https://www.ipsos.com/sites/default/files/ct/news/documents/2020-06/topline-abc_ipsos-poll-june-25-2020-trend.pdf
2020-10-14,2020-06-21,2020-06-23,1,YouGov,B,0,0.32982628,0.0,False,a,all,1500.0,22.0,38.0,27.0,13.0,26.450464,35.378439,24.721761,12.715038,21:45:23 14 Oct 2020,https://docs.cdn.yougov.com/cjd35jrh5o/econTabReport.pdf
2020-10-14,2020-06-23,2020-06-23,1,Data for Progress,B-,0,0.69487546,0.0,False,a,all,855.0,28.75,39.18,18.94,12.75,28.598019,38.118534,19.234531,12.896414,21:45:23 14 Oct 2020,https://docs.google.com/spreadsheets/d/1jqgTFa89Ef_7Nx_s5CqGj_aYciJkukoSnihIjoU8r4I/edit
2020-10-14,2020-06-18,2020-06-22,0,Global Strategy Group/GBAO/Navigator Research,,0,0.36477891,0.0,False,rv,all,1313.0,43.0,40.0,13.0,4.0,50.314852,34.419535,11.251029,3.0680561,21:45:20 14 Oct 2020,https://navigatorresearch.org/wp-content/uploads/2020/06/Navigating-Coronavirus-Full-Topline-F06.24.20.pdf
2020-10-14,2020-06-19,2020-06-22,0,Ipsos,B-,0,0.51467211,0.0,False,a,all,1023.0,52.0,33.0,9.0,3.0,52.262696,33.058454,9.0182577,2.5279595,21:45:20 14 Oct 2020,https://www.ipsos.com/sites/default/files/ct/news/documents/2020-06/topline-axios-poll-wave-14.pdf
2020-10-14,2020-06-18,2020-06-22,1,Global Strategy Group/GBAO/Navigator Research,,0,0.36477891,0.0,False,rv,all,1313.0,32.5,31.0,24.0,12.0,28.98797,32.449109,23.447611,13.118814,21:45:23 14 Oct 2020,https://navigatorresearch.org/wp-content/uploads/2020/06/Navigating-Coronavirus-Full-Topline-F06.24.20.pdf
2020-10-14,2020-06-19,2020-06-22,1,YouGov,B,0,0.22201446,0.0,False,a,all,1000.0,31.0,38.0,18.0,10.0,35.450464,35.378439,15.721761,9.715038,21:45:23 14 Oct 2020,https://docs.cdn.yougov.com/mksvh1nepl/tabs_HP_Coronavirus_20200619.pdf
2020-10-14,2020-06-18,2020-06-21,0,Morning Consult,B/C,0,0.36414496,0.0,False,rv,all,1995.0,60.0,27.0,4.0,3.0,57.109742,30.503972,7.2688006,3.6497741,21:45:20 14 Oct 2020,https://assets.morningconsult.com/wp-uploads/2020/07/14101853/200674_crosstabs_CORONAVIRUS_CONTENT_RVs_v2_JB.pdf
2020-10-14,2020-06-15,2020-06-21,1,Gallup,B,0,0.80566211,0.0,False,a,all,3803.0,9.0,39.0,35.0,18.0,23.983621,34.097817,25.889916,15.378007,21:45:23 14 Oct 2020,https://news.gallup.com/poll/308222/coronavirus-pandemic.aspx
2020-10-14,2020-06-19,2020-06-21,1,Léger,,0,0.29758001,0.0,False,a,all,1002.0,23.0,35.0,21.0,17.0,26.820666,34.464003,21.321945,14.301862,21:45:23 14 Oct 2020,https://leger360.com/wp-content/uploads/2020/06/Leger-National-weekly-pandemic-tracker-june-22nd-2020-1.pdf
2020-10-14,2020-06-18,2020-06-20,0,Harris Insights & Analytics,C,0,0.34260495,0.0,False,a,all,1962.0,52.0,35.0,10.0,3.0,54.148549,32.831347,9.931115,2.0396212,21:45:20 14 Oct 2020,https://theharrispoll.com/wp-content/uploads/2020/06/Wave-17_Tabs_Banner-3.pdf
2020-10-14,2020-06-13,2020-06-16,0,Harris Insights & Analytics,C,0,0.36170758,0.0,False,a,all,1963.0,49.0,35.0,10.0,5.0,51.148549,32.831347,9.931115,4.0396212,21:45:20 14 Oct 2020,https://theharrispoll.com/wp-content/uploads/2020/06/Wave-16_tabs_Banner-1.pdf
2020-10-14,2020-06-09,2020-06-16,1,Optimus,B/C,1,0.40321661,0.0,False,a,all,859.0,23.9,35.8,23.6,12.5,26.643239,33.930713,22.126173,12.694184,21:45:23 14 Oct 2020,https://github.com/optimus-forecasting-and-polling/0ptimus-Coronavirus-Tracking/tree/master/June-18-2020
2020-10-14,2020-06-12,2020-06-16,1,Echelon Insights,,0,0.73091959,0.0,False,rv,all,1000.0,46.0,27.0,27.0,1.0,36.860174,30.126997,26.73578,5.8683142,21:45:23 14 Oct 2020,https://echeloninsights.com/in-the-news/september-omnibus-covid/
2020-10-14,2020-06-14,2020-06-16,1,YouGov,B,0,0.34744342,0.0,False,a,all,1500.0,21.0,38.0,28.0,13.0,25.450464,35.378439,25.721761,12.715038,21:45:23 14 Oct 2020,https://docs.cdn.yougov.com/vgqowgynze/econTabReport.pdf
2020-10-14,2020-06-11,2020-06-15,0,Global Strategy Group/GBAO/Navigator Research,,0,0.26501376,0.0,False,rv,all,1009.0,44.0,39.0,11.0,6.0,51.314852,33.419535,9.2510295,5.0680561,21:45:20 14 Oct 2020,https://navigatorresearch.org/wp-content/uploads/2020/06/Navigating-Coronavirus-Full-Topline-F06.18.20.pdf
2020-10-14,2020-06-12,2020-06-15,0,Ipsos,B-,0,0.50856042,0.0,False,a,all,1022.0,54.0,33.0,10.0,3.0,54.262696,33.058454,10.018258,2.5279595,21:45:20 14 Oct 2020,https://www.ipsos.com/sites/default/files/ct/news/documents/2020-06/topline-axios-poll-w13.pdf
2020-10-14,2020-06-11,2020-06-15,1,AP-NORC,,0,1.1105611,0.0,False,a,all,1310.0,32.0,36.0,22.0,9.0,28.516904,36.979967,22.091302,10.432568,21:45:23 14 Oct 2020,http://apnorc.org/PDFs/AP-NORC%20June%202020/Topline_covid.pdf
2020-10-14,2020-06-11,2020-06-15,1,Quinnipiac University,B+,0,1.6512506,0.0,False,rv,all,1332.0,36.0,33.0,15.0,16.0,31.369745,33.77448,17.721292,16.090469,21:45:23 14 Oct 2020,https://poll.qu.edu/national/release-detail?ReleaseID=3664
2020-10-14,2020-06-11,2020-06-15,1,Global Strategy Group/GBAO/Navigator Research,,0,0.26501376,0.0,False,rv,all,1009.0,34.5,31.5,22.0,12.0,30.98797,32.949109,21.447611,13.118814,21:45:23 14 Oct 2020,https://navigatorresearch.org/wp-content/uploads/2020/06/Navigating-Coronavirus-Full-Topline-F06.18.20.pdf
2020-10-14,2020-06-12,2020-06-14,0,Morning Consult,B/C,0,0.39348336,0.0,False,a,all,2200.0,58.0,27.0,4.0,3.0,55.109742,30.503972,7.2688006,3.6497741,21:45:20 14 Oct 2020,https://assets.morningconsult.com/wp-uploads/2020/06/15150404/200652_crosstabs_CORONAVIRUS_CONTENT_Adults_v2_JB.pdf
2020-10-14,2020-06-08,2020-06-14,1,Gallup,B,0,0.75538133,0.0,False,a,all,3624.0,9.0,40.0,34.0,18.0,23.983621,35.097817,24.889916,15.378007,21:45:23 14 Oct 2020,https://news.gallup.com/poll/308222/coronavirus-pandemic.aspx
2020-10-14,2020-06-12,2020-06-14,1,YouGov,B,0,0.23245782,0.0,False,a,all,1000.0,29.0,37.0,19.0,11.0,33.450464,34.378439,16.721761,10.715038,21:45:23 14 Oct 2020,https://docs.cdn.yougov.com/4xyjgiwnim/tabs_HP_Coronavirus_20200612.pdf
2020-10-14,2020-06-12,2020-06-14,1,Léger,,0,0.29751549,0.0,False,a,all,1004.0,26.0,34.0,19.0,17.0,29.820666,33.464003,19.321945,14.301862,21:45:23 14 Oct 2020,https://leger360.com/wp-content/uploads/2020/06/Leger-National-Weekly-Pandemic-Tracker-June-15-2020.pdf
2020-10-14,2020-06-06,2020-06-13,1,Optimus,B/C,1,0.15565379,0.0,False,a,all,337.125,26.0,37.8,22.4,12.3,28.743239,35.930713,20.926173,12.494184,21:45:23 14 Oct 2020,https://github.com/optimus-forecasting-and-polling/0ptimus-Coronavirus-Tracking/tree/master/June-15-2020
2020-10-14,2020-06-10,2020-06-11,1,Ipsos,B-,0,0.71103248,0.0,False,a,all,686.0,28.0,41.0,23.0,8.0,27.706481,37.438749,23.801208,10.206017,21:45:23 14 Oct 2020,https://www.ipsos.com/sites/default/files/ct/news/documents/2020-06/topline-abc-coronavirus-wave-12.pdf
2020-10-14,2020-06-02,2020-06-09,1,Optimus,B/C,1,0.18901853,0.0,False,a,all,426.0,26.5,34.9,24.0,14.3,29.243239,33.030713,22.526173,14.494184,21:45:23 14 Oct 2020,https://github.com/optimus-forecasting-and-polling/0ptimus-Coronavirus-Tracking/tree/master/June-11-2020
2020-10-14,2020-06-07,2020-06-09,1,YouGov,B,0,0.33965462,0.0,False,a,all,1500.0,20.0,38.0,28.0,14.0,24.450464,35.378439,25.721761,13.715038,21:45:23 14 Oct 2020,https://docs.cdn.yougov.com/ngcg634q9k/econTabReport.pdf
2020-10-14,2020-06-09,2020-06-09,1,Data for Progress,B-,0,0.6465468,0.0,False,a,all,836.0,24.83,38.51,22.47,13.59,24.678019,37.448534,22.764531,13.736414,21:45:23 14 Oct 2020,https://docs.google.com/spreadsheets/d/1Ulb7_xHlxGXMc9CFALO64lP5Tow0Qsh6ENzKySO9fnc/edit
2020-10-14,2020-06-04,2020-06-08,0,Global Strategy Group/GBAO/Navigator Research,,0,0.39580952,0.0,False,rv,all,1608.0,40.0,41.0,15.0,4.0,47.314852,35.419535,13.251029,3.0680561,21:45:20 14 Oct 2020,https://navigatorresearch.org/wp-content/uploads/2020/06/Navigating-Coronavirus-Full-Topline-F06.11.20.pdf
2020-10-14,2020-06-06,2020-06-08,0,Harris Insights & Analytics,C,0,0.36378299,0.0,False,a,all,1969.0,51.0,34.0,11.0,4.0,53.148549,31.831347,10.931115,3.0396212,21:45:20 14 Oct 2020,https://theharrispoll.com/wp-content/uploads/2020/06/Wave-15-Data-Tabs.pdf
2020-10-14,2020-06-05,2020-06-08,0,Ipsos,B-,0,0.51114974,0.0,False,a,all,1006.0,48.0,33.0,11.0,7.0,48.262696,33.058454,11.018258,6.5279595,21:45:20 14 Oct 2020,https://www.ipsos.com/sites/default/files/ct/news/documents/2020-06/topline-axios-wave-12.pdf
2020-10-14,2020-06-04,2020-06-08,1,Global Strategy Group/GBAO/Navigator Research,,0,0.39580952,0.0,False,rv,all,1608.0,31.5,33.5,22.5,13.0,27.98797,34.949109,21.947611,14.118814,21:45:23 14 Oct 2020,https://navigatorresearch.org/wp-content/uploads/2020/06/Navigating-Coronavirus-Full-Topline-F06.11.20.pdf
2020-10-14,2020-06-05,2020-06-07,0,Morning Consult,B/C,0,0.38854137,0.0,False,a,all,2200.0,56.0,29.0,6.0,2.0,53.109742,32.503972,9.2688006,2.6497741,21:45:20 14 Oct 2020,https://assets.morningconsult.com/wp-uploads/2020/06/08131854/200617_crosstabs_CORONAVIRUS_CONTENT_Adults_v2_JB.pdf
2020-10-14,2020-06-01,2020-06-07,1,Gallup,B,0,0.81340223,0.0,False,a,all,4000.0,8.0,39.0,35.0,18.0,22.983621,34.097817,25.889916,15.378007,21:45:23 14 Oct 2020,https://news.gallup.com/poll/308222/coronavirus-pandemic.aspx
2020-10-14,2020-06-05,2020-06-07,1,YouGov,B,0,0.22293521,0.0,False,a,all,1000.0,26.0,36.0,23.0,11.0,30.450464,33.378439,20.721761,10.715038,21:45:23 14 Oct 2020,https://docs.cdn.yougov.com/4x2nsulvy0/tabs_HP_Coronavirus_20200605.pdf
2020-10-14,2020-06-05,2020-06-07,1,Léger,,0,0.29361501,0.0,False,a,all,1001.0,23.5,34.5,20.5,17.5,27.320666,33.964003,20.821945,14.801862,21:45:23 14 Oct 2020,https://leger360.com/wp-content/uploads/2020/06/Leger-National-Weekly-Pandemic-Tracker-June-8th-2020.pdf
2020-10-14,2020-05-30,2020-06-06,1,Optimus,B/C,1,0.14514977,0.0,False,a,all,333.375,23.7,37.6,23.9,14.3,26.443239,35.730713,22.426173,14.494184,21:45:23 14 Oct 2020,https://github.com/optimus-forecasting-and-polling/0ptimus-Coronavirus-Tracking/tree/master/June-08-2020
2020-10-14,2020-05-21,2020-06-05,1,AP-NORC,,0,2.0004004,0.0,False,a,all,3404.0,22.0,38.0,28.0,12.0,18.516904,38.979967,28.091302,13.432568,21:45:23 14 Oct 2020,https://www.aei.org/wp-content/uploads/2020/06/AEI-COVID-19-and-American-Life-Survey-Topline.pdf
2020-10-14,2020-06-01,2020-06-03,1,Civiqs,B/C,0,0.9783632,0.0,False,a,all,1327.0,14.0,37.0,20.0,29.0,21.721105,35.77344,17.104675,24.950138,21:45:23 14 Oct 2020,https://civiqs.com/documents/Civiqs_DailyKos_monthly_banner_book_2020_06_z972k3.pdf
2020-10-14,2020-05-26,2020-06-02,1,Optimus,B/C,1,0.19622074,0.0,False,a,all,453.5,22.8,39.2,24.9,12.2,25.543239,37.330713,23.426173,12.394184,21:45:23 14 Oct 2020,https://github.com/optimus-forecasting-and-polling/0ptimus-Coronavirus-Tracking/tree/master/June-04-2020
2020-10-14,2020-05-28,2020-06-02,1,NBC News/The Wall Street Journal,A-,0,1.646268,0.0,False,rv,all,1000.0,25.0,38.0,24.0,11.0,27.409518,36.627984,22.801287,10.923634,21:45:23 14 Oct 2020,https://assets.documentcloud.org/documents/6938425/200266-NBCWSJ-June-Poll.pdf
2020-10-14,2020-05-31,2020-06-02,1,YouGov,B,0,0.31497914,0.0,False,a,all,1500.0,20.0,38.0,28.0,13.0,24.450464,35.378439,25.721761,12.715038,21:45:23 14 Oct 2020,https://docs.cdn.yougov.com/c00sty9kik/econTabReport.pdf
2020-10-14,2020-05-28,2020-06-01,0,Global Strategy Group/GBAO/Navigator Research,,0,0.25240654,0.0,False,rv,all,1007.0,46.0,38.0,12.0,4.0,53.314852,32.419535,10.251029,3.0680561,21:45:20 14 Oct 2020,https://navigatorresearch.org/wp-content/uploads/2020/06/Navigating-Coronavirus-Tracking-Topline-F06.02.20.pdf
2020-10-14,2020-05-29,2020-06-01,0,Ipsos,B-,0,0.56885976,0.0,False,a,all,1033.0,54.0,31.0,8.0,4.0,54.262696,31.058454,8.0182577,3.5279595,21:45:20 14 Oct 2020,https://www.ipsos.com/sites/default/files/ct/news/documents/2020-06/topline-axios-wave-11.pdf
2020-10-14,2020-05-29,2020-06-01,0,Morning Consult,B/C,0,0.39373042,0.0,False,a,all,2200.0,61.0,27.0,3.0,2.0,58.109742,30.503972,6.2688006,2.6497741,21:45:20 14 Oct 2020,https://assets.morningconsult.com/wp-uploads/2020/06/03113851/2005110_crosstabs_CORONAVIRUS_CONTENT_Adults_v2_JB.pdf
2020-10-14,2020-05-28,2020-06-01,1,Global Strategy Group/GBAO/Navigator Research,,0,0.25240654,0.0,False,rv,all,1007.0,33.0,32.5,24.5,9.5,29.48797,33.949109,23.947611,10.618814,21:45:23 14 Oct 2020,https://navigatorresearch.org/wp-content/uploads/2020/06/Navigating-Coronavirus-Tracking-Topline-F06.02.20.pdf
2020-10-14,2020-05-28,2020-06-01,1,Monmouth University,A+,0,1.7933224,0.0,False,a,all,807.0,37.0,32.0,14.0,16.0,31.905941,34.893968,16.482392,14.90665,21:45:23 14 Oct 2020,https://www.monmouth.edu/polling-institute/documents/monmouthpoll_us_061520.pdf/
2020-10-14,2020-05-29,2020-06-01,1,YouGov,B,0,0.43160739,0.0,False,a,all,2071.0,30.0,39.0,19.0,11.0,34.450464,36.378439,16.721761,10.715038,21:45:23 14 Oct 2020,https://drive.google.com/file/d/1ypj11mR3myQIudjo1R9Cv--lS4P2Mpq3/view
2020-10-14,2020-05-29,2020-05-31,0,Change Research,C-,0,0.67527082,0.0,False,lv,all,1457.0,42.0,37.0,18.0,4.0,47.117781,35.653317,13.584782,3.7676724,21:45:20 14 Oct 2020,https://www.changeresearch.com/post/states-of-play-battleground-wave-6
2020-10-14,2020-05-29,2020-05-31,0,Harris Insights & Analytics,C,0,0.37568641,0.0,False,a,all,1965.0,55.0,33.0,8.0,3.0,57.148549,30.831347,7.931115,2.0396212,21:45:20 14 Oct 2020,https://theharrispoll.com/wp-content/uploads/2020/06/Wave-14.pdf
2020-10-14,2020-05-25,2020-05-31,1,Gallup,B,0,0.7798824,0.0,False,a,all,3916.0,9.0,38.0,36.0,16.0,23.983621,33.097817,26.889916,13.378007,21:45:23 14 Oct 2020,https://news.gallup.com/poll/308222/coronavirus-pandemic.aspx
2020-10-14,2020-05-29,2020-05-31,1,YouGov,B,0,0.21027158,0.0,False,a,all,1000.0,29.0,36.0,21.0,10.0,33.450464,33.378439,18.721761,9.715038,21:45:23 14 Oct 2020,https://docs.cdn.yougov.com/2gy7be8emb/tabs_HP_Coronavirus_20200529.pdf
2020-10-14,2020-05-29,2020-05-31,1,Léger,,0,0.29386663,0.0,False,a,all,1002.0,25.5,34.5,20.0,17.0,29.320666,33.964003,20.321945,14.301862,21:45:23 14 Oct 2020,https://leger360.com/wp-content/uploads/2020/06/Leger-National-Weekly-Pandemic-Tracker-June-1-2020.pdf
2020-10-14,2020-05-23,2020-05-30,1,Optimus,B/C,1,0.14833193,0.0,False,a,all,340.5,24.6,36.3,27.4,10.7,27.343239,34.430713,25.926173,10.894184,21:45:23 14 Oct 2020,https://github.com/optimus-forecasting-and-polling/0ptimus-Coronavirus-Tracking/tree/master/June-01-2020
2020-10-14,2020-05-27,2020-05-28,0,Harris Insights & Analytics,C,0,0.38442321,0.0,False,a,all,1996.0,54.0,33.0,9.0,4.0,56.148549,30.831347,8.931115,3.0396212,21:45:20 14 Oct 2020,https://theharrispoll.com/wp-content/uploads/2020/06/Wave-14.pdf
2020-10-14,2020-05-25,2020-05-28,1,ABC News/The Washington Post,A+,0,2.0282351,0.0,False,a,all,1001.0,30.0,33.0,22.0,13.0,33.241627,32.513427,21.403735,11.150696,21:45:23 14 Oct 2020,https://www.washingtonpost.com/context/may-25-28-2020-washington-post-abc-news-poll/bb30c35e-797e-4b5c-91fc-1a1cdfbe85cc/
2020-10-14,2020-05-21,2020-05-27,1,TargetSmart/William & Mary,B/C,0,1.001729,0.0,False,rv,all,1200.0,26.0,38.0,22.0,13.0,26.864328,36.813182,21.700867,13.25078,21:45:23 14 Oct 2020,https://insights.targetsmart.com/Analysis/covid_national_survey_may_2020/tsmart_TS_COVID_2_banner_book.pdf
2020-10-14,2020-05-19,2020-05-26,1,Optimus,B/C,1,0.19445065,0.0,False,a,all,450.5,26.5,37.0,25.5,10.2,29.243239,35.130713,24.026173,10.394184,21:45:23 14 Oct 2020,https://github.com/optimus-forecasting-and-polling/Firehouse-0ptimus-Coronavirus-Tracking/tree/master/May-28-2020
2020-10-14,2020-05-23,2020-05-26,1,YouGov,B,0,0.31804386,0.0,False,a,all,1500.0,24.0,40.0,25.0,11.0,28.450464,37.378439,22.721761,10.715038,21:45:23 14 Oct 2020,https://docs.cdn.yougov.com/5fsvmrvvhh/econTabReport.pdf
2020-10-14,2020-05-26,2020-05-26,1,Data for Progress,B-,0,0.52264087,0.0,False,a,all,833.0,34.82,36.24,19.17,9.48,34.668019,35.178534,19.464531,9.6264142,21:45:23 14 Oct 2020,https://docs.google.com/spreadsheets/d/1m82bllf9dvqaktcX8vRc9QLar8zdjykJrf84NkfIft8/edit
2020-10-14,2020-05-21,2020-05-25,0,Global Strategy Group/GBAO/Navigator Research,,0,0.24100402,0.0,False,rv,all,1012.0,47.0,40.0,9.0,4.0,54.314852,34.419535,7.2510295,3.0680561,21:45:20 14 Oct 2020,https://navigatorresearch.org/wp-content/uploads/2020/05/Navigating-Coronavirus-Tracking-Topline-F05.26.20.pdf
2020-10-14,2020-05-21,2020-05-25,0,Morning Consult,B/C,0,0.40260724,0.0,False,a,all,2200.0,62.0,25.0,3.0,3.0,59.109742,28.503972,6.2688006,3.6497741,21:45:20 14 Oct 2020,https://assets.morningconsult.com/wp-uploads/2020/05/26135319/200572_crosstabs_CORONAVIRUS_CONTENT_Adults_v2_JB.pdf
2020-10-14,2020-05-21,2020-05-25,1,Global Strategy Group/GBAO/Navigator Research,,0,0.24100402,0.0,False,rv,all,1012.0,37.0,35.5,20.0,7.5,33.48797,36.949109,19.447611,8.6188139,21:45:23 14 Oct 2020,https://navigatorresearch.org/wp-content/uploads/2020/05/Navigating-Coronavirus-Tracking-Topline-F05.26.20.pdf
2020-10-14,2020-05-22,2020-05-25,1,Léger,,0,0.29850205,0.0,False,a,all,1005.0,28.5,37.0,17.0,15.5,32.320666,36.464003,17.321945,12.801862,21:45:23 14 Oct 2020,https://leger360.com/wp-content/uploads/2020/05/Leger-National-weekly-pandemic-tracker-May-25-2020.pdf
2020-10-14,2020-05-18,2020-05-24,1,Gallup,B,0,0.75168829,0.0,False,a,all,3892.0,9.0,43.0,34.0,14.0,23.983621,38.097817,24.889916,11.378007,21:45:23 14 Oct 2020,https://news.gallup.com/poll/308222/coronavirus-pandemic.aspx
2020-10-14,2020-05-22,2020-05-24,1,YouGov,B,0,0.21230979,0.0,False,a,all,1000.0,32.0,34.0,21.0,9.0,36.450464,31.378439,18.721761,8.715038,21:45:23 14 Oct 2020,https://docs.cdn.yougov.com/ld11fmv27h/tabs_HP_Coronavirus_20200522.pdf
2020-10-14,2020-05-16,2020-05-23,1,Optimus,B/C,1,0.14755956,0.0,False,a,all,341.625,27.6,37.4,24.8,9.7,30.343239,35.530713,23.326173,9.8941837,21:45:23 14 Oct 2020,https://github.com/optimus-forecasting-and-polling/Firehouse-0ptimus-Coronavirus-Tracking/tree/master/May-25-2020
2020-10-14,2020-05-20,2020-05-21,1,Ipsos,B-,0,0.6087776,0.0,False,a,all,733.0,36.0,42.0,15.0,7.0,35.706481,38.438749,15.801208,9.206017,21:45:23 14 Oct 2020,https://www.ipsos.com/sites/default/files/ct/news/documents/2020-05/topline-abc-coronavirus-wave-10.pdf
2020-10-14,2020-05-17,2020-05-20,1,Fox News/Beacon Research/Shaw & Co. Research,A-,0,1.9577412,0.0,False,rv,all,1207.0,35.0,36.0,18.0,10.0,32.935284,36.330989,18.409871,10.654006,21:45:23 14 Oct 2020,https://static.foxnews.com/foxnews.com/content/uploads/2020/05/Fox_May-17-20-2020_Complete_National_Topline_May-21-Release.pdf
2020-10-14,2020-05-18,2020-05-20,1,Echelon Insights,,0,0.70920768,0.0,False,lv,all,1000.0,45.0,32.0,21.0,2.0,35.860174,35.126997,20.73578,6.8683142,21:45:23 14 Oct 2020,https://echeloninsights.com/in-the-news/september-omnibus-covid/
2020-10-14,2020-05-12,2020-05-19,1,Optimus,B/C,1,0.19712627,0.0,False,a,all,456.0,28.5,38.5,22.2,10.5,31.243239,36.630713,20.726173,10.694184,21:45:23 14 Oct 2020,https://github.com/optimus-forecasting-and-polling/Firehouse-0ptimus-Coronavirus-Tracking/tree/master/May-21-2020
2020-10-14,2020-05-17,2020-05-19,1,YouGov,B,0,0.3125999,0.0,False,a,all,1500.0,21.0,41.0,25.0,13.0,25.450464,38.378439,22.721761,12.715038,21:45:23 14 Oct 2020,https://docs.cdn.yougov.com/q0t43bjops/econTabReport.pdf
2020-10-14,2020-05-19,2020-05-19,1,Data for Progress,B-,0,0.51909802,0.0,False,a,all,934.0,29.98,38.49,20.17,10.46,29.828019,37.428534,20.464531,10.606414,21:45:23 14 Oct 2020,https://doi.org/10.7910/DVN/XJLZIN
2020-10-14,2020-05-15,2020-05-18,0,Global Strategy Group/GBAO/Navigator Research,,1,0.22385926,0.0,False,rv,all,1011.0,44.0,45.0,8.0,3.0,51.314852,39.419535,6.2510295,2.0680561,21:45:20 14 Oct 2020,https://navigatorresearch.org/wp-content/uploads/2020/05/Navigating-Coronavirus-Tracking-Topline-F05.19.20.pdf
2020-10-14,2020-05-15,2020-05-18,0,Ipsos,B-,0,0.57228829,0.0,False,a,all,1009.0,62.0,28.0,7.0,3.0,62.262696,28.058454,7.0182577,2.5279595,21:45:20 14 Oct 2020,https://www.ipsos.com/sites/default/files/ct/news/documents/2020-05/topline-axios-wave-10.pdf
2020-10-14,2020-05-14,2020-05-18,1,Quinnipiac University,B+,0,1.7004943,0.0,False,rv,all,1323.0,45.0,32.0,15.0,8.0,40.369745,32.77448,17.721292,8.0904689,21:45:23 14 Oct 2020,https://poll.qu.edu/national/release-detail?ReleaseID=3661
2020-10-14,2020-05-14,2020-05-18,1,AP-NORC,,0,0.80287014,0.0,False,a,all,1056.0,42.0,31.0,18.0,7.0,38.516904,31.979967,18.091302,8.4325683,21:45:23 14 Oct 2020,http://www.apnorc.org/projects/Documents/may_reopen_topline_5_20.pdf
2020-10-14,2020-05-15,2020-05-18,1,Global Strategy Group/GBAO/Navigator Research,,1,0.22385926,0.0,False,rv,all,1011.0,34.5,35.0,21.5,8.5,30.98797,36.449109,20.947611,9.6188139,21:45:23 14 Oct 2020,https://navigatorresearch.org/wp-content/uploads/2020/05/Navigating-Coronavirus-Tracking-Topline-F05.19.20.pdf
2020-10-14,2020-05-15,2020-05-17,0,Morning Consult,B/C,0,0.36823905,0.0,False,rv,all,1995.0,67.0,23.0,3.0,1.0,64.109742,26.503972,6.2688006,1.6497741,21:45:20 14 Oct 2020,https://assets.morningconsult.com/wp-uploads/2020/05/19123311/200550_crosstabs_CORONAVIRUS_CONTENT_RVs_v2_JB.pdf
2020-10-14,2020-05-15,2020-05-17,0,Harris Insights & Analytics,C,0,0.41765252,0.0,False,a,all,1961.0,58.0,30.0,9.0,3.0,60.148549,27.831347,8.931115,2.0396212,21:45:20 14 Oct 2020,https://theharrispoll.com/wp-content/uploads/2020/05/Wave-2-12_tabs.pdf
2020-10-14,2020-05-15,2020-05-17,0,Change Research,C-,0,0.56543167,0.0,False,lv,all,1424.0,47.0,33.0,18.0,2.0,52.117781,31.653317,13.584782,1.7676724,21:45:20 14 Oct 2020,https://www.changeresearch.com/post/states-of-play-battleground-wave-4
2020-10-14,2020-05-11,2020-05-17,1,Gallup,B,0,0.75774861,0.0,False,a,all,4117.0,10.0,41.0,34.0,16.0,24.983621,36.097817,24.889916,13.378007,21:45:23 14 Oct 2020,https://news.gallup.com/poll/308222/coronavirus-pandemic.aspx
2020-10-14,2020-05-15,2020-05-17,1,Léger,,0,0.30125624,0.0,False,a,all,1001.0,28.0,35.0,19.0,13.5,31.820666,34.464003,19.321945,10.801862,21:45:23 14 Oct 2020,https://leger360.com/wp-content/uploads/2020/05/Leger-National-Weekly-Pandemic-Tracker-May-19-2020.pdf
2020-10-14,2020-05-15,2020-05-17,1,YouGov,B,0,0.20810723,0.0,False,a,all,1000.0,34.0,40.0,16.0,7.0,38.450464,37.378439,13.721761,6.715038,21:45:23 14 Oct 2020,https://big.assets.huffingtonpost.com/athena/files/2020/05/22/5ec83680c5b600109ea0d27d.pdf
2020-10-14,2020-05-15,2020-05-17,1,Change Research,C-,0,0.71102484,0.0,False,lv,all,1424.0,48.0,22.0,20.0,9.0,44.59426,27.149425,16.789904,9.6363876,21:45:23 14 Oct 2020,https://www.changeresearch.com/post/states-of-play-battleground-wave-4
2020-10-14,2020-05-09,2020-05-16,1,Optimus,B/C,1,0.14617512,0.0,False,a,all,334.875,28.6,37.6,20.9,12.4,31.343239,35.730713,19.426173,12.594184,21:45:23 14 Oct 2020,https://github.com/optimus-forecasting-and-polling/Firehouse-0ptimus-Coronavirus-Tracking/tree/master/May-18-2020
2020-10-14,2020-05-12,2020-05-15,0,Global Strategy Group/GBAO/Navigator Research,,1,0.1655117,0.0,False,rv,all,758.25,48.0,38.0,8.0,6.0,55.314852,32.419535,6.2510295,5.0680561,21:45:20 14 Oct 2020,https://navigatorresearch.org/wp-content/uploads/2020/05/Navigator-Daily-Tracker-Topline-F05.15.20.pdf
2020-10-14,2020-05-12,2020-05-15,1,Global Strategy Group/GBAO/Navigator Research,,1,0.1655117,0.0,False,rv,all,758.25,40.5,32.0,18.0,9.5,36.98797,33.449109,17.447611,10.618814,21:45:23 14 Oct 2020,https://navigatorresearch.org/wp-content/uploads/2020/05/Navigator-Daily-Tracker-Topline-F05.15.20.pdf
2020-10-14,2020-05-11,2020-05-14,0,Global Strategy Group/GBAO/Navigator Research,,1,0.05506474,0.0,False,rv,all,252.5,47.0,38.0,10.0,5.0,54.314852,32.419535,8.2510295,4.0680561,21:45:20 14 Oct 2020,https://navigatorresearch.org/wp-content/uploads/2020/05/Navigator-Daily-Tracker-Topline-F05.14.20.pdf
2020-10-14,2020-05-11,2020-05-14,1,Global Strategy Group/GBAO/Navigator Research,,1,0.05506027,0.0,False,rv,all,252.5,38.0,35.0,18.5,9.0,34.48797,36.449109,17.947611,10.118814,21:45:23 14 Oct 2020,https://navigatorresearch.org/wp-content/uploads/2020/05/Navigator-Daily-Tracker-Topline-F05.14.20.pdf
2020-10-14,2020-05-13,2020-05-14,1,Harris Insights & Analytics,C,0,1.1878596,0.0,False,rv,all,1854.0,22.0,36.0,25.0,17.0,22.991663,36.164366,24.442886,15.396771,21:45:23 14 Oct 2020,https://harvardharrispoll.com/wp-content/uploads/2020/05/May20_HHP_RegisteredVoters_Crosstabs.pdf
2020-10-14,2020-05-13,2020-05-14,1,Ipsos,B-,0,0.42890183,0.0,False,a,all,564.0,36.0,43.0,17.0,5.0,35.706481,39.438749,17.801208,7.206017,21:45:23 14 Oct 2020,https://www.ipsos.com/sites/default/files/ct/news/documents/2020-05/topline-abc-coronavirus-wave-9.pdf
2020-10-14,2020-05-08,2020-05-13,0,Global Strategy Group/GBAO/Navigator Research,,1,0.10948868,0.0,False,rv,all,505.0,45.0,41.0,9.0,4.0,52.314852,35.419535,7.2510295,3.0680561,21:45:20 14 Oct 2020,https://navigatorresearch.org/wp-content/uploads/2020/05/Navigator-Daily-Tracker-Topline-F05.13.20.pdf
2020-10-14,2020-05-08,2020-05-13,1,Global Strategy Group/GBAO/Navigator Research,,1,0.10944423,0.0,False,rv,all,505.0,37.5,34.5,19.5,9.0,33.98797,35.949109,18.947611,10.118814,21:45:23 14 Oct 2020,https://navigatorresearch.org/wp-content/uploads/2020/05/Navigator-Daily-Tracker-Topline-F05.13.20.pdf
2020-10-14,2020-05-11,2020-05-13,1,YouGov,B,0,0.39012967,0.0,False,a,all,2000.0,32.0,40.0,18.0,9.0,36.450464,37.378439,15.721761,8.715038,21:45:23 14 Oct 2020,https://drive.google.com/file/d/1uFybAzWKhjq0M7MdhDFQwNEeeFrlyyaU/view
2020-10-14,2020-05-07,2020-05-12,0,Global Strategy Group/GBAO/Navigator Research,,1,0.0366242,0.0,False,rv,all,168.16667,45.0,41.0,11.0,3.0,52.314852,35.419535,9.2510295,2.0680561,21:45:20 14 Oct 2020,https://navigatorresearch.org/wp-content/uploads/2020/05/Navigator-Daily-Tracker-Topline-F05.12.20.pdf
2020-10-14,2020-05-05,2020-05-12,1,Optimus,B/C,1,0.17942064,0.0,False,a,all,410.5,31.0,35.4,21.2,11.4,33.743239,33.530713,19.726173,11.594184,21:45:23 14 Oct 2020,https://github.com/optimus-forecasting-and-polling/Firehouse-0ptimus-Coronavirus-Tracking/tree/master/May-14-2020
2020-10-14,2020-05-07,2020-05-12,1,Global Strategy Group/GBAO/Navigator Research,,1,0.036599,0.0,False,rv,all,168.16667,35.0,35.5,21.5,8.5,31.48797,36.949109,20.947611,9.6188139,21:45:23 14 Oct 2020,https://navigatorresearch.org/wp-content/uploads/2020/05/Navigator-Daily-Tracker-Topline-F05.12.20.pdf
2020-10-14,2020-05-10,2020-05-12,1,YouGov,B,0,0.29011858,0.0,False,a,all,1500.0,24.0,40.0,25.0,11.0,28.450464,37.378439,22.721761,10.715038,21:45:23 14 Oct 2020,https://docs.cdn.yougov.com/sww5v5iven/econTabReport.pdf
2020-10-14,2020-05-12,2020-05-12,1,Data for Progress,B-,0,0.432289,0.0,False,a,all,817.0,33.67,39.51,16.44,9.85,33.518019,38.448534,16.734531,9.9964142,21:45:23 14 Oct 2020,https://docs.google.com/spreadsheets/d/1WuukVMHY020EbSvNGK22X-Onb8BwBZ58ZW1BrXUAzIg/edit
2020-10-14,2020-05-06,2020-05-11,0,Global Strategy Group/GBAO/Navigator Research,,1,0.03729745,0.0,False,rv,all,170.0,48.0,40.0,9.0,3.0,55.314852,34.419535,7.2510295,2.0680561,21:45:20 14 Oct 2020,https://navigatorresearch.org/wp-content/uploads/2020/05/Navigator-Daily-Tracker-Topline-F05.11.20.pdf
2020-10-14,2020-05-08,2020-05-11,0,Ipsos,B-,0,0.5332837,0.0,False,a,all,980.0,60.0,28.0,8.0,3.0,60.262696,28.058454,8.0182577,2.5279595,21:45:20 14 Oct 2020,https://www.ipsos.com/sites/default/files/ct/news/documents/2020-05/topline-axios-wave-9.pdf
2020-10-14,2020-05-06,2020-05-11,1,Global Strategy Group/GBAO/Navigator Research,,1,0.03725698,0.0,False,rv,all,170.0,36.5,34.0,21.5,8.5,32.98797,35.449109,20.947611,9.6188139,21:45:23 14 Oct 2020,https://navigatorresearch.org/wp-content/uploads/2020/05/Navigator-Daily-Tracker-Topline-F05.11.20.pdf
2020-10-14,2020-05-08,2020-05-10,0,Harris Insights & Analytics,C,0,0.40591514,0.0,False,a,all,2030.0,51.0,33.0,11.0,5.0,53.148549,30.831347,10.931115,4.0396212,21:45:20 14 Oct 2020,https://theharrispoll.com/wp-content/uploads/2020/05/Wave-2-11.pdf
2020-10-14,2020-05-08,2020-05-10,0,Morning Consult,B/C,0,0.39490595,0.0,False,a,all,2200.0,64.0,24.0,3.0,1.0,61.109742,27.503972,6.2688006,1.6497741,21:45:20 14 Oct 2020,https://assets.morningconsult.com/wp-uploads/2020/05/12122705/200529_crosstabs_CORONAVIRUS_CONTENT_Adults_v2_JB.pdf
2020-10-14,2020-05-04,2020-05-10,1,Gallup,B,0,0.70683578,0.0,False,a,all,4159.0,11.0,42.0,34.0,13.0,25.983621,37.097817,24.889916,10.378007,21:45:23 14 Oct 2020,https://news.gallup.com/poll/308222/coronavirus-pandemic.aspx
2020-10-14,2020-05-05,2020-05-10,1,ABC News/The Washington Post,A+,0,1.8891837,0.0,False,a,all,1007.0,22.0,36.0,24.0,17.0,25.241627,35.513427,23.403735,15.150696,21:45:23 14 Oct 2020,https://www.washingtonpost.com/context/may-5-10-2020-washington-post-university-of-maryland-poll/722b3348-4f59-4b35-9fa0-2f9eb4ac76c0/?itid=lk_inline_manual_1
2020-10-14,2020-05-08,2020-05-10,1,YouGov,B,0,0.19348093,0.0,False,a,all,1000.0,33.0,35.0,19.0,8.0,37.450464,32.378439,16.721761,7.715038,21:45:23 14 Oct 2020,https://big.assets.huffingtonpost.com/athena/files/2020/05/15/5ebec87ac5b65727da7b17b2.pdf
2020-10-14,2020-05-08,2020-05-10,1,Léger,,0,0.30197309,0.0,False,a,all,1004.0,27.5,38.0,18.5,14.0,31.320666,37.464003,18.821945,11.301862,21:45:23 14 Oct 2020,https://leger360.com/wp-content/uploads/2020/05/Leger-National-Weekly-Pandemic-Tracker-May-11-2020_VF.pdf
2020-10-14,2020-05-02,2020-05-09,1,Optimus,B/C,1,0.134978,0.0,False,a,all,307.875,31.6,39.9,18.8,8.7,34.343239,38.030713,17.326173,8.8941837,21:45:23 14 Oct 2020,https://github.com/optimus-forecasting-and-polling/Firehouse-0ptimus-Coronavirus-Tracking/tree/master/May-11-2020
2020-10-14,2020-05-05,2020-05-08,0,Global Strategy Group/GBAO/Navigator Research,,1,0.05690739,0.0,False,rv,all,255.5,48.0,39.0,10.0,3.0,55.314852,33.419535,8.2510295,2.0680561,21:45:20 14 Oct 2020,https://navigatorresearch.org/wp-content/uploads/2020/05/Navigator-Daily-Tracker-Topline-F05.08.20.pdf
2020-10-14,2020-05-05,2020-05-08,1,Global Strategy Group/GBAO/Navigator Research,,1,0.05678102,0.0,False,rv,all,255.5,37.0,35.0,20.5,7.5,33.48797,36.449109,19.947611,8.6188139,21:45:23 14 Oct 2020,https://navigatorresearch.org/wp-content/uploads/2020/05/Navigator-Daily-Tracker-Topline-F05.08.20.pdf
2020-10-14,2020-05-04,2020-05-07,0,Global Strategy Group/GBAO/Navigator Research,,1,0.05640113,0.0,False,rv,all,252.5,49.0,40.0,8.0,3.0,56.314852,34.419535,6.2510295,2.0680561,21:45:20 14 Oct 2020,https://navigatorresearch.org/wp-content/uploads/2020/05/Navigator-Daily-Tracker-Topline-F05.07.20.pdf
2020-10-14,2020-05-04,2020-05-07,1,Global Strategy Group/GBAO/Navigator Research,,1,0.05623319,0.0,False,rv,all,252.5,37.0,34.5,20.5,7.0,33.48797,35.949109,19.947611,8.1188139,21:45:23 14 Oct 2020,https://navigatorresearch.org/wp-content/uploads/2020/05/Navigator-Daily-Tracker-Topline-F05.07.20.pdf
2020-10-14,2020-05-06,2020-05-07,1,Ipsos,B-,0,0.3908222,0.0,False,a,all,532.0,35.0,42.0,17.0,6.0,34.706481,38.438749,17.801208,8.206017,21:45:23 14 Oct 2020,https://www.ipsos.com/sites/default/files/ct/news/documents/2020-05/topline-abc-coronavirus-wave-8.pdf
2020-10-14,2020-05-01,2020-05-06,0,Global Strategy Group/GBAO/Navigator Research,,1,0.11329975,0.0,False,rv,all,507.0,50.0,39.0,8.0,3.0,57.314852,33.419535,6.2510295,2.0680561,21:45:20 14 Oct 2020,https://navigatorresearch.org/wp-content/uploads/2020/05/Navigator-Daily-Tracker-Topline-F05.06.20.pdf
2020-10-14,2020-05-01,2020-05-06,1,Global Strategy Group/GBAO/Navigator Research,,1,0.11278855,0.0,False,rv,all,507.0,38.5,32.5,21.0,8.5,34.98797,33.949109,20.447611,9.6188139,21:45:23 14 Oct 2020,https://navigatorresearch.org/wp-content/uploads/2020/05/Navigator-Daily-Tracker-Topline-F05.06.20.pdf
2020-10-14,2020-04-30,2020-05-05,0,Global Strategy Group/GBAO/Navigator Research,,1,0.03772517,0.0,False,rv,all,167.5,49.0,39.0,8.0,4.0,56.314852,33.419535,6.2510295,3.0680561,21:45:20 14 Oct 2020,https://navigatorresearch.org/wp-content/uploads/2020/05/Navigator-Daily-Tracker-Topline-F05.05.20.pdf
2020-10-14,2020-04-28,2020-05-05,1,Optimus,B/C,1,0.19624825,0.0,False,a,all,449.5,30.5,40.5,20.1,8.0,33.243239,38.630713,18.626173,8.1941837,21:45:23 14 Oct 2020,https://github.com/optimus-forecasting-and-polling/Firehouse-0ptimus-Coronavirus-Tracking/tree/master/May-07-2020
2020-10-14,2020-04-30,2020-05-05,1,Global Strategy Group/GBAO/Navigator Research,,1,0.03752696,0.0,False,rv,all,167.5,37.5,32.0,22.0,8.5,33.98797,33.449109,21.447611,9.6188139,21:45:23 14 Oct 2020,https://navigatorresearch.org/wp-content/uploads/2020/05/Navigator-Daily-Tracker-Topline-F05.05.20.pdf
2020-10-14,2020-05-03,2020-05-05,1,YouGov,B,0,0.27852381,0.0,False,a,all,1500.0,24.0,42.0,25.0,9.0,28.450464,39.378439,22.721761,8.715038,21:45:23 14 Oct 2020,https://docs.cdn.yougov.com/5yope37lqh/econTabReport.pdf
2020-10-14,2020-05-02,2020-05-05,1,Civiqs,B/C,0,0.88991008,0.0,False,a,all,1546.0,16.0,37.0,28.0,18.0,23.721105,35.77344,25.104675,13.950138,21:45:23 14 Oct 2020,https://civiqs.com/documents/Civiqs_DailyKos_monthly_banner_book_2020_05_r8c32an.pdf
2020-10-14,2020-05-05,2020-05-05,1,Data for Progress,B-,0,0.47133873,0.0,False,a,all,918.0,36.47,38.35,16.05,8.63,36.318019,37.288534,16.344531,8.7764142,21:45:23 14 Oct 2020,https://docs.google.com/spreadsheets/d/1cj1W_9MLHk5A_j0c0I-UMH28UMGJ3_nULmtU6_Y2OI4/edit
2020-10-14,2020-04-29,2020-05-04,0,Global Strategy Group/GBAO/Navigator Research,,1,0.03848431,0.0,False,rv,all,169.0,49.0,38.0,10.0,3.0,56.314852,32.419535,8.2510295,2.0680561,21:45:20 14 Oct 2020,https://navigatorresearch.org/wp-content/uploads/2020/05/Navigator-Daily-Tracker-Topline-F05.04.20.pdf
2020-10-14,2020-05-01,2020-05-04,0,Ipsos,B-,0,0.57696543,0.0,False,a,all,1012.0,56.0,30.0,9.0,4.0,56.262696,30.058454,9.0182577,3.5279595,21:45:20 14 Oct 2020,https://www.ipsos.com/sites/default/files/ct/news/documents/2020-05/topline-axios-wave-8.pdf
2020-10-14,2020-04-30,2020-05-04,1,AP-NORC,,0,0.92322898,0.0,False,a,all,1002.0,47.0,29.0,17.0,6.0,43.516904,29.979967,17.091302,7.4325683,21:45:23 14 Oct 2020,http://www.apnorc.org/projects/Documents/topline_divinity_policy.pdf
2020-10-14,2020-04-29,2020-05-04,1,Global Strategy Group/GBAO/Navigator Research,,1,0.03825412,0.0,False,rv,all,169.0,36.5,33.5,21.0,9.0,32.98797,34.949109,20.447611,10.118814,21:45:23 14 Oct 2020,https://navigatorresearch.org/wp-content/uploads/2020/05/Navigator-Daily-Tracker-Topline-F05.04.20.pdf
2020-10-14,2020-04-30,2020-05-04,1,Monmouth University,A+,0,1.7930771,0.0,False,a,all,808.0,42.0,28.0,14.0,16.0,36.905941,30.893968,16.482392,14.90665,21:45:23 14 Oct 2020,https://www.monmouth.edu/polling-institute/documents/monmouthpoll_us_051120.pdf/
2020-10-14,2020-05-01,2020-05-04,1,Garin-Hart-Yang Research Group,B/C,0,1.1337666,0.0,False,a,all,1002.0,33.0,37.0,20.0,9.0,29.415132,36.655833,21.302753,10.751726,21:45:23 14 Oct 2020,https://caringacross.org/wp-content/uploads/2020/05/FI12876-CAGNDWA-Topline-Results-for-Public-Release-May-1-4-2020.pdf
2020-10-14,2020-05-01,2020-05-03,0,Morning Consult,B/C,0,0.38752538,0.0,False,a,all,2200.0,66.0,20.0,3.0,2.0,63.109742,23.503972,6.2688006,2.6497741,21:45:20 14 Oct 2020,https://assets.morningconsult.com/wp-uploads/2020/07/24151813/2004107_crosstabs_CORONAVIRUS_CONTENT_Adults_v2_JB.pdf
2020-10-14,2020-05-01,2020-05-03,0,Harris Insights & Analytics,C,0,0.39258221,0.0,False,a,all,2039.0,54.0,33.0,9.0,3.0,56.148549,30.831347,8.931115,2.0396212,21:45:20 14 Oct 2020,https://theharrispoll.com/wp-content/uploads/2020/05/Wave-2-10_tabs_Banner-11.pdf
2020-10-14,2020-05-01,2020-05-03,0,Change Research,C-,0,0.58089943,0.0,False,lv,all,1489.0,49.0,34.0,13.0,4.0,54.117781,32.653317,8.5847823,3.7676724,21:45:20 14 Oct 2020,https://www.changeresearch.com/post/states-of-play-battleground-wave-4
2020-10-14,2020-04-27,2020-05-03,1,Gallup,B,0,0.6784946,0.0,False,a,all,4553.0,11.0,38.0,36.0,15.0,25.983621,33.097817,26.889916,12.378007,21:45:23 14 Oct 2020,https://news.gallup.com/poll/308222/coronavirus-pandemic.aspx
2020-10-14,2020-04-28,2020-05-03,1,ABC News/The Washington Post,A+,0,1.8395679,0.0,False,a,all,1005.0,21.0,42.0,21.0,16.0,24.241627,41.513427,20.403735,14.150696,21:45:23 14 Oct 2020,https://www.washingtonpost.com/context/washington-post-university-of-maryland-national-poll-april-28-may-3-2020/9ac3c026-f68c-4733-82a0-daa6862d99b3/
2020-10-14,2020-05-01,2020-05-03,1,Change Research,C-,0,0.73213212,0.0,False,lv,all,1489.0,44.0,22.0,25.0,10.0,40.59426,27.149425,21.789904,10.636388,21:45:23 14 Oct 2020,https://www.changeresearch.com/post/states-of-play-battleground-wave-4
2020-10-14,2020-05-01,2020-05-03,1,YouGov,B,0,0.18272891,0.0,False,a,all,1000.0,32.0,40.0,16.0,9.0,36.450464,37.378439,13.721761,8.715038,21:45:23 14 Oct 2020,https://big.assets.huffingtonpost.com/athena/files/2020/05/07/5eb484aac5b6c8214cf4bade.pdf
2020-10-14,2020-05-01,2020-05-03,1,Léger,,0,0.29853227,0.0,False,a,all,1002.0,31.0,35.0,18.0,13.0,34.820666,34.464003,18.321945,10.301862,21:45:23 14 Oct 2020,https://leger360.com/wp-content/uploads/2020/05/Leger-National-COVID-19-Tracking-Report-May-4-2020-1.pdf
2020-10-14,2020-04-25,2020-05-02,1,Optimus,B/C,1,0.14925905,0.0,False,a,all,341.25,29.7,38.2,22.0,9.0,32.443239,36.330713,20.526173,9.1941837,21:45:23 14 Oct 2020,https://github.com/optimus-forecasting-and-polling/Firehouse-0ptimus-Coronavirus-Tracking/tree/master/May-04-2020
2020-10-14,2020-04-28,2020-05-01,0,Global Strategy Group/GBAO/Navigator Research,,1,0.05899739,0.0,False,rv,all,255.5,47.0,38.0,10.0,4.0,54.314852,32.419535,8.2510295,3.0680561,21:45:20 14 Oct 2020,https://navigatorresearch.org/wp-content/uploads/2020/05/Navigator-Daily-Tracker-Topline-F05.01.20.pdf
2020-10-14,2020-04-28,2020-05-01,1,Global Strategy Group/GBAO/Navigator Research,,1,0.05855502,0.0,False,rv,all,255.5,36.0,35.5,20.5,8.0,32.48797,36.949109,19.947611,9.1188139,21:45:23 14 Oct 2020,https://navigatorresearch.org/wp-content/uploads/2020/05/Navigator-Daily-Tracker-Topline-F05.01.20.pdf
2020-10-14,2020-04-28,2020-05-01,1,YouGov,B,0,0.39667145,0.0,False,a,all,2200.0,29.0,41.0,17.0,12.0,33.450464,38.378439,14.721761,11.715038,21:45:23 14 Oct 2020,https://drive.google.com/file/d/1rPmATVVPfzsgn-1g7m9zX-PfFVgPXCGY/view
2020-10-14,2020-04-27,2020-04-30,0,Global Strategy Group/GBAO/Navigator Research,,1,0.05855608,0.0,False,rv,all,252.0,47.0,40.0,9.0,4.0,54.314852,34.419535,7.2510295,3.0680561,21:45:20 14 Oct 2020,https://navigatorresearch.org/wp-content/uploads/2020/04/Navigator-Daily-Tracker-Topline-F04.30.20.pdf
2020-10-14,2020-04-27,2020-04-30,1,Global Strategy Group/GBAO/Navigator Research,,1,0.05807099,0.0,False,rv,all,252.0,37.0,35.0,21.0,6.5,33.48797,36.449109,20.447611,7.6188139,21:45:23 14 Oct 2020,https://navigatorresearch.org/wp-content/uploads/2020/04/Navigator-Daily-Tracker-Topline-F04.30.20.pdf
2020-10-14,2020-04-29,2020-04-30,1,Ipsos,B-,0,0.37067932,0.0,False,a,all,518.0,39.0,42.0,13.0,4.0,38.706481,38.438749,13.801208,6.206017,21:45:23 14 Oct 2020,https://abcnews.go.com/Politics/americans-uneasy-returning-normal-restrictions-loosen-poll/story?id=70423858
2020-10-14,2020-04-24,2020-04-29,0,Global Strategy Group/GBAO/Navigator Research,,1,0.11702557,0.0,False,rv,all,502.0,47.0,42.0,8.0,3.0,54.314852,36.419535,6.2510295,2.0680561,21:45:20 14 Oct 2020,https://navigatorresearch.org/wp-content/uploads/2020/04/Navigator-Daily-Tracker-Topline-F04.29.20.pdf
2020-10-14,2020-04-24,2020-04-29,1,Global Strategy Group/GBAO/Navigator Research,,1,0.11578041,0.0,False,rv,all,502.0,38.5,35.5,20.0,6.5,34.98797,36.949109,19.447611,7.6188139,21:45:23 14 Oct 2020,https://navigatorresearch.org/wp-content/uploads/2020/04/Navigator-Daily-Tracker-Topline-F04.29.20.pdf
2020-10-14,2020-04-23,2020-04-28,0,Global Strategy Group/GBAO/Navigator Research,,1,0.03948811,0.0,False,rv,all,168.66667,44.0,45.0,8.0,3.0,51.314852,39.419535,6.2510295,2.0680561,21:45:20 14 Oct 2020,https://navigatorresearch.org/wp-content/uploads/2020/04/Navigator-Daily-Tracker-Topline-F04.28.20.pdf
2020-10-14,2020-04-21,2020-04-28,1,Optimus,B/C,1,0.19085933,0.0,False,a,all,437.0,28.9,40.9,20.3,9.0,31.643239,39.030713,18.826173,9.1941837,21:45:23 14 Oct 2020,https://github.com/optimus-forecasting-and-polling/Firehouse-0ptimus-Coronavirus-Tracking/tree/master/April-30-2020
2020-10-14,2020-04-23,2020-04-28,1,Global Strategy Group/GBAO/Navigator Research,,1,0.03901618,0.0,False,rv,all,168.66667,38.0,35.5,21.5,5.5,34.48797,36.949109,20.947611,6.6188139,21:45:23 14 Oct 2020,https://navigatorresearch.org/wp-content/uploads/2020/04/Navigator-Daily-Tracker-Topline-F04.28.20.pdf
2020-10-14,2020-04-26,2020-04-28,1,YouGov,B,0,0.27029059,0.0,False,a,all,1500.0,22.0,42.0,27.0,10.0,26.450464,39.378439,24.721761,9.715038,21:45:23 14 Oct 2020,https://docs.cdn.yougov.com/pwwefjdnsp/econTabReport.pdf
2020-10-14,2020-04-28,2020-04-28,1,Data for Progress,B-,0,0.53642235,0.0,False,a,all,1048.0,36.21,36.36,18.21,8.46,36.058019,35.298534,18.504531,8.6064142,21:45:23 14 Oct 2020,https://docs.google.com/spreadsheets/d/1zA_YTHzyYFjKcjwUD6fvtkemZ7BOSJ0p2AcEhTI9kJY/edit
2020-10-14,2020-04-22,2020-04-27,0,Global Strategy Group/GBAO/Navigator Research,,1,0.04054765,0.0,False,rv,all,171.83333,42.0,45.0,10.0,2.0,49.314852,39.419535,8.2510295,1.0680561,21:45:20 14 Oct 2020,https://navigatorresearch.org/wp-content/uploads/2020/04/Navigator-Daily-Tracker-Topline-F04.27.20.pdf
2020-10-14,2020-04-25,2020-04-27,0,Harris Insights & Analytics,C,0,0.39477757,0.0,False,a,all,2050.0,57.0,30.0,8.0,5.0,59.148549,27.831347,7.931115,4.0396212,21:45:20 14 Oct 2020,https://theharrispoll.com/wp-content/uploads/2020/04/The-Harris-Poll_COVID19-Tracker-Wave-9.pdf
2020-10-14,2020-04-24,2020-04-27,0,Ipsos,B-,0,0.68277957,0.0,False,a,all,1021.0,61.0,26.0,8.0,4.0,61.262696,26.058454,8.0182577,3.5279595,21:45:20 14 Oct 2020,https://www.ipsos.com/sites/default/files/ct/news/documents/2020-04/topline-axios-wave-7.pdf
2020-10-14,2020-04-22,2020-04-27,1,Global Strategy Group/GBAO/Navigator Research,,1,0.03999652,0.0,False,rv,all,171.83333,36.5,34.5,23.0,5.5,32.98797,35.949109,22.447611,6.6188139,21:45:23 14 Oct 2020,https://navigatorresearch.org/wp-content/uploads/2020/04/Navigator-Daily-Tracker-Topline-F04.27.20.pdf
2020-10-14,2020-04-24,2020-04-26,0,Morning Consult,B/C,0,0.37509369,0.0,False,a,all,2200.0,67.0,21.0,3.0,1.0,64.109742,24.503972,6.2688006,1.6497741,21:45:20 14 Oct 2020,https://morningconsult.com/wp-content/uploads/2020/04/200479_crosstabs_CORONAVIRUS_CONTENT_Adults_v2_JB.pdf
2020-10-14,2020-04-17,2020-04-26,1,PureSpectrum,,0,1.2901684,0.0,False,a,all,22921.0,39.5,33.5,16.0,8.5,36.835326,34.675826,17.393646,8.9218429,21:45:23 14 Oct 2020,https://www.washingtonpost.com/politics/2020/04/29/these-three-governors-are-reopening-their-states-faster-than-their-voters-want/
2020-10-14,2020-04-20,2020-04-26,1,Gallup,B,0,1.0197916,0.0,False,a,all,7921.0,13.0,43.0,33.0,12.0,27.983621,38.097817,23.889916,9.3780074,21:45:23 14 Oct 2020,https://news.gallup.com/poll/308222/coronavirus-pandemic.aspx
2020-10-14,2020-04-21,2020-04-26,1,ABC News/The Washington Post,A+,0,1.8510409,0.0,False,a,all,1008.0,20.0,40.0,25.0,15.0,23.241627,39.513427,24.403735,13.150696,21:45:23 14 Oct 2020,https://www.washingtonpost.com/context/washington-post-university-of-maryland-national-poll-april-21-26-2020/3583b4e9-66be-4ed6-a457-f6630a550ddf/
2020-10-14,2020-04-24,2020-04-26,1,Léger,,0,0.30448884,0.0,False,a,all,1016.0,31.0,35.0,17.5,12.5,34.820666,34.464003,17.821945,9.8018622,21:45:23 14 Oct 2020,https://leger360.com/wp-content/uploads/2020/04/tracking_covid19_13386-124_EN_week6-1-1.pdf
2020-10-14,2020-04-24,2020-04-26,1,YouGov,B,0,0.18098394,0.0,False,a,all,1000.0,38.0,31.0,18.0,8.0,42.450464,28.378439,15.721761,7.715038,21:45:23 14 Oct 2020,https://big.assets.huffingtonpost.com/athena/files/2020/05/07/5eb484a9c5b62d0addac2c45.pdf
2020-10-14,2020-04-18,2020-04-25,1,Optimus,B/C,1,0.14420422,0.0,False,a,all,328.5,27.8,43.1,19.2,9.2,30.543239,41.230713,17.726173,9.3941837,21:45:23 14 Oct 2020,https://github.com/optimus-forecasting-and-polling/Firehouse-0ptimus-Coronavirus-Tracking/tree/master/April-27-2020
2020-10-14,2020-04-21,2020-04-24,0,Global Strategy Group/GBAO/Navigator Research,,1,0.06157912,0.0,False,rv,all,258.75,41.0,44.0,12.0,3.0,48.314852,38.419535,10.251029,2.0680561,21:45:20 14 Oct 2020,https://navigatorresearch.org/wp-content/uploads/2020/04/Navigator-Daily-Tracker-Topline-F04.24.20.pdf
2020-10-14,2020-04-21,2020-04-24,1,Global Strategy Group/GBAO/Navigator Research,,1,0.06046433,0.0,False,rv,all,258.75,36.5,36.5,22.5,5.5,32.98797,37.949109,21.947611,6.6188139,21:45:23 14 Oct 2020,https://navigatorresearch.org/wp-content/uploads/2020/04/Navigator-Daily-Tracker-Topline-F04.24.20.pdf
2020-10-14,2020-04-20,2020-04-23,0,Global Strategy Group/GBAO/Navigator Research,,1,0.06033833,0.0,False,rv,all,252.5,45.0,42.0,11.0,3.0,52.314852,36.419535,9.2510295,2.0680561,21:45:20 14 Oct 2020,https://navigatorresearch.org/wp-content/uploads/2020/04/Navigator-Daily-Tracker-Topline-F04.23.20.pdf
2020-10-14,2020-04-20,2020-04-23,1,Global Strategy Group/GBAO/Navigator Research,,1,0.05907193,0.0,False,rv,all,252.5,36.5,37.5,20.0,6.5,32.98797,38.949109,19.447611,7.6188139,21:45:23 14 Oct 2020,https://navigatorresearch.org/wp-content/uploads/2020/04/Navigator-Daily-Tracker-Topline-F04.23.20.pdf
2020-10-14,2020-04-22,2020-04-23,1,Ipsos,B-,0,0.34242783,0.0,False,a,all,506.0,42.0,40.0,14.0,4.0,41.706481,36.438749,14.801208,6.206017,21:45:23 14 Oct 2020,https://www.ipsos.com/sites/default/files/ct/news/documents/2020-04/topline-abc-coronavirus-wave-6.pdf
2020-10-14,2020-04-17,2020-04-22,0,Global Strategy Group/GBAO/Navigator Research,,1,0.122699,0.0,False,rv,all,511.0,43.0,42.0,12.0,3.0,50.314852,36.419535,10.251029,2.0680561,21:45:20 14 Oct 2020,https://navigatorresearch.org/wp-content/uploads/2020/04/Navigator-Daily-Tracker-Topline-F04.22.20.pdf
2020-10-14,2020-04-17,2020-04-22,1,Global Strategy Group/GBAO/Navigator Research,,1,0.11933488,0.0,False,rv,all,511.0,37.5,35.5,20.0,7.0,33.98797,36.949109,19.447611,8.1188139,21:45:23 14 Oct 2020,https://navigatorresearch.org/wp-content/uploads/2020/04/Navigator-Daily-Tracker-Topline-F04.22.20.pdf
2020-10-14,2020-04-20,2020-04-22,1,YouGov,B,0,0.37120992,0.0,False,a,all,2112.0,33.0,40.0,18.0,9.0,37.450464,37.378439,15.721761,8.715038,21:45:23 14 Oct 2020,https://drive.google.com/file/d/1jFnCuET4kyT9V0q9ov5xsKMCEo7PyqR8/view
2020-10-14,2020-04-16,2020-04-21,0,Global Strategy Group/GBAO/Navigator Research,,1,0.04080015,0.0,False,rv,all,168.66667,44.0,41.0,12.0,3.0,51.314852,35.419535,10.251029,2.0680561,21:45:20 14 Oct 2020,https://navigatorresearch.org/wp-content/uploads/2020/04/Navigator-Daily-Tracker-Topline-F04.21.20.pdf
2020-10-14,2020-04-14,2020-04-21,1,Optimus,B/C,1,0.20535642,0.0,False,a,all,464.5,29.8,40.3,20.9,8.3,32.543239,38.430713,19.426173,8.4941837,21:45:23 14 Oct 2020,https://github.com/optimus-forecasting-and-polling/Firehouse-0ptimus-Coronavirus-Tracking/tree/master/April-23-2020
2020-10-14,2020-04-16,2020-04-21,1,Global Strategy Group/GBAO/Navigator Research,,1,0.03954776,0.0,False,rv,all,168.66667,37.0,34.0,21.0,8.0,33.48797,35.449109,20.447611,9.1188139,21:45:23 14 Oct 2020,https://navigatorresearch.org/wp-content/uploads/2020/04/Navigator-Daily-Tracker-Topline-F04.21.20.pdf
2020-10-14,2020-04-19,2020-04-21,1,YouGov,B,0,0.26352793,0.0,False,a,all,1500.0,22.0,44.0,24.0,10.0,26.450464,41.378439,21.721761,9.715038,21:45:23 14 Oct 2020,https://docs.cdn.yougov.com/pwwefjdnsp/econTabReport.pdf
2020-10-14,2020-04-18,2020-04-21,1,Echelon Insights,,0,0.72829005,0.0,False,rv,all,1000.0,60.0,27.0,13.0,1.0,50.860174,30.126997,12.73578,5.8683142,21:45:23 14 Oct 2020,https://echeloninsights.com/in-the-news/september-omnibus-covid/
2020-10-14,2020-04-21,2020-04-21,1,Data for Progress,B-,0,0.54739659,0.0,False,a,all,998.0,34.92,40.95,15.75,8.12,34.768019,39.888534,16.044531,8.2664142,21:45:23 14 Oct 2020,https://docs.google.com/spreadsheets/d/1y1QYjWQR3NNsGZaGXtJy94KDbh9RgepLOHshNkwqEAY/edit
2020-10-14,2020-04-15,2020-04-20,0,Global Strategy Group/GBAO/Navigator Research,,1,0.0410084,0.0,False,rv,all,167.66667,44.0,42.0,12.0,2.0,51.314852,36.419535,10.251029,1.0680561,21:45:20 14 Oct 2020,https://navigatorresearch.org/wp-content/uploads/2020/04/Navigator-Daily-Tracker-Topline-F04.20.20.pdf
2020-10-14,2020-04-18,2020-04-20,0,Harris Insights & Analytics,C,0,0.40277863,0.0,False,a,all,2029.0,56.0,34.0,7.0,4.0,58.148549,31.831347,6.931115,3.0396212,21:45:20 14 Oct 2020,https://theharrispoll.com/wp-content/uploads/2020/04/Wave-2-8_tabs_updated.pdf
2020-10-14,2020-04-15,2020-04-20,1,Global Strategy Group/GBAO/Navigator Research,,1,0.03961424,0.0,False,rv,all,167.66667,34.5,34.0,23.0,8.5,30.98797,35.449109,22.447611,9.6188139,21:45:23 14 Oct 2020,https://navigatorresearch.org/wp-content/uploads/2020/04/Navigator-Daily-Tracker-Topline-F04.20.20.pdf
2020-10-14,2020-04-16,2020-04-20,1,AP-NORC,,0,1.0735133,0.0,False,a,all,1057.0,43.0,35.0,17.0,5.0,39.516904,35.979967,17.091302,6.4325683,21:45:23 14 Oct 2020,http://www.apnorc.org/projects/Documents/4_22_20_govt_topline.pdf
2020-10-14,2020-04-17,2020-04-19,0,Morning Consult,B/C,0,0.35927201,0.0,False,a,all,2200.0,66.0,23.0,4.0,2.0,63.109742,26.503972,7.2688006,2.6497741,21:45:20 14 Oct 2020,https://morningconsult.com/wp-content/uploads/2020/04/200451_crosstabs_CORONAVIRUS_CONTENT_Adults_v2_JB.pdf
2020-10-14,2020-04-13,2020-04-19,1,Gallup,B,0,1.0185812,0.0,False,a,all,8106.0,12.0,42.0,34.0,12.0,26.983621,37.097817,24.889916,9.3780074,21:45:23 14 Oct 2020,https://news.gallup.com/poll/308222/coronavirus-pandemic.aspx
2020-10-14,2020-04-14,2020-04-19,1,ABC News/The Washington Post,A+,0,1.9062418,0.0,False,a,all,1013.0,20.0,37.0,27.0,16.0,23.241627,36.513427,26.403735,14.150696,21:45:23 14 Oct 2020,https://www.washingtonpost.com/context/april-14-19-washington-post-u-md-poll/4521bb45-b844-4dbd-b72d-0a298cf7539a/
2020-10-14,2020-04-17,2020-04-19,1,Léger,,0,0.30518448,0.0,False,a,all,1001.0,29.5,37.0,18.0,12.0,33.320666,36.464003,18.321945,9.3018622,21:45:23 14 Oct 2020,https://leger360.com/wp-content/uploads/2020/04/tracking_covid19_13386-124_EN_week5_VF_Final-1.pdf
2020-10-14,2020-04-17,2020-04-19,1,YouGov,B,0,0.17852399,0.0,False,a,all,1000.0,36.0,36.0,16.0,8.0,40.450464,33.378439,13.721761,7.715038,21:45:23 14 Oct 2020,https://big.assets.huffingtonpost.com/athena/files/2020/04/20/5e9e1857c5b63c5b58734cc0.pdf
2020-10-14,2020-04-17,2020-04-18,0,Change Research,C-,0,0.53068049,0.0,False,lv,all,1178.0,47.0,32.0,18.0,3.0,52.117781,30.653317,13.584782,2.7676724,21:45:20 14 Oct 2020,https://www.changeresearch.com/post/states-of-play-battleground-wave-3
2020-10-14,2020-04-11,2020-04-18,1,Optimus,B/C,1,0.14111091,0.0,False,a,all,315.75,32.4,37.8,21.0,8.2,35.143239,35.930713,19.526173,8.3941837,21:45:23 14 Oct 2020,https://github.com/optimus-forecasting-and-polling/Firehouse-0ptimus-Coronavirus-Tracking/tree/master/April-20-2020
2020-10-14,2020-04-14,2020-04-17,0,Global Strategy Group/GBAO/Navigator Research,,1,0.06177246,0.0,False,rv,all,249.25,49.0,37.0,10.0,3.0,56.314852,31.419535,8.2510295,2.0680561,21:45:20 14 Oct 2020,https://navigatorresearch.org/wp-content/uploads/2020/04/Navigator-Daily-Tracker-Topline-F04.17.20.pdf
2020-10-14,2020-04-14,2020-04-17,1,Global Strategy Group/GBAO/Navigator Research,,1,0.05921715,0.0,False,rv,all,249.25,34.5,35.5,22.5,7.5,30.98797,36.949109,21.947611,8.6188139,21:45:23 14 Oct 2020,https://navigatorresearch.org/wp-content/uploads/2020/04/Navigator-Daily-Tracker-Topline-F04.17.20.pdf
2020-10-14,2020-04-13,2020-04-16,0,Global Strategy Group/GBAO/Navigator Research,,1,0.06310198,0.0,False,rv,all,252.75,47.0,39.0,11.0,4.0,54.314852,33.419535,9.2510295,3.0680561,21:45:20 14 Oct 2020,https://navigatorresearch.org/wp-content/uploads/2020/04/Navigator-Daily-Tracker-Topline-F04.16.20.pdf
2020-10-14,2020-04-13,2020-04-16,1,Global Strategy Group/GBAO/Navigator Research,,1,0.06025383,0.0,False,rv,all,252.75,35.5,33.5,23.0,7.5,31.98797,34.949109,22.447611,8.6188139,21:45:23 14 Oct 2020,https://navigatorresearch.org/wp-content/uploads/2020/04/Navigator-Daily-Tracker-Topline-F04.16.20.pdf
2020-10-14,2020-04-15,2020-04-16,1,Ipsos,B-,0,0.31831038,0.0,False,a,all,514.0,41.0,40.0,15.0,5.0,40.706481,36.438749,15.801208,7.206017,21:45:23 14 Oct 2020,https://www.ipsos.com/sites/default/files/ct/news/documents/2020-04/topline_abc_ipsos_poll_april_16_2020_trend.pdf
2020-10-14,2020-04-10,2020-04-15,0,Global Strategy Group/GBAO/Navigator Research,,1,0.12858821,0.0,False,rv,all,507.5,45.0,39.0,12.0,5.0,52.314852,33.419535,10.251029,4.0680561,21:45:20 14 Oct 2020,https://navigatorresearch.org/wp-content/uploads/2020/04/Navigator-Daily-Tracker-Topline-F04.15.20.pdf
2020-10-14,2020-04-10,2020-04-15,1,Global Strategy Group/GBAO/Navigator Research,,1,0.12155862,0.0,False,rv,all,507.5,39.0,32.5,20.5,8.0,35.48797,33.949109,19.947611,9.1188139,21:45:23 14 Oct 2020,https://navigatorresearch.org/wp-content/uploads/2020/04/Navigator-Daily-Tracker-Topline-F04.15.20.pdf
2020-10-14,2020-04-13,2020-04-15,1,NBC News/The Wall Street Journal,A-,0,1.4896917,0.0,False,rv,all,900.0,33.0,40.0,18.0,7.0,35.409518,38.627984,16.801287,6.9236343,21:45:23 14 Oct 2020,https://www.documentcloud.org/documents/6842659-200203-NBCWSJ-April-Poll-4-19-20-Release.html
2020-10-14,2020-04-09,2020-04-14,0,Global Strategy Group/GBAO/Navigator Research,,1,0.04293676,0.0,False,rv,all,167.16667,44.0,40.0,10.0,6.0,51.314852,34.419535,8.2510295,5.0680561,21:45:20 14 Oct 2020,https://navigatorresearch.org/wp-content/uploads/2020/04/Navigator-Daily-Tracker-Topline-F04.14.20.pdf
2020-10-14,2020-04-07,2020-04-14,1,Optimus,B/C,1,0.19409954,0.0,False,a,all,430.5,31.4,40.8,21.9,5.5,34.143239,38.930713,20.426173,5.6941837,21:45:23 14 Oct 2020,https://github.com/optimus-forecasting-and-polling/Firehouse-0ptimus-Coronavirus-Tracking/tree/master/April-16-2020
2020-10-14,2020-04-10,2020-04-14,1,SurveyMonkey,D-,0,0.66151658,0.0,False,a,all,5755.0,38.0,35.0,21.0,5.0,36.406934,35.684755,20.169623,6.4018653,21:45:23 14 Oct 2020,https://www.surveymonkey.com/curiosity/fortune-poll-coronavirus-airlines/
2020-10-14,2020-04-09,2020-04-14,1,Global Strategy Group/GBAO/Navigator Research,,1,0.04029588,0.0,False,rv,all,167.16667,38.5,33.0,19.5,9.5,34.98797,34.449109,18.947611,10.618814,21:45:23 14 Oct 2020,https://navigatorresearch.org/wp-content/uploads/2020/04/Navigator-Daily-Tracker-Topline-F04.14.20.pdf
2020-10-14,2020-04-11,2020-04-14,1,Civiqs,B/C,0,0.823025,0.0,False,a,all,1600.0,16.0,39.0,29.0,15.0,23.721105,37.77344,26.104675,10.950138,21:45:23 14 Oct 2020,https://civiqs.com/documents/Civiqs_DailyKos_monthly_banner_book_2020_04_p837y2s.pdf
2020-10-14,2020-04-12,2020-04-14,1,YouGov,B,0,0.26432064,0.0,False,a,all,1500.0,23.0,45.0,23.0,9.0,27.450464,42.378439,20.721761,8.715038,21:45:23 14 Oct 2020,https://docs.cdn.yougov.com/6fdl23u606/econTabReport.pdf
2020-10-14,2020-04-14,2020-04-14,1,Data for Progress,B-,0,0.61863571,0.0,False,a,all,940.0,35.75,38.67,17.25,8.32,35.598019,37.608534,17.544531,8.4664142,21:45:23 14 Oct 2020,https://docs.google.com/spreadsheets/d/1KKNL9a_uVJK36tOaR9_Eepcw4bKWrwTew85dwGyY_S0/edit
2020-10-14,2020-04-08,2020-04-13,0,Global Strategy Group/GBAO/Navigator Research,,1,0.04380186,0.0,False,rv,all,167.66667,45.0,38.0,10.0,7.0,52.314852,32.419535,8.2510295,6.0680561,21:45:20 14 Oct 2020,https://navigatorresearch.org/wp-content/uploads/2020/04/Navigator-Daily-Tracker-Topline-F04.13.20.pdf
2020-10-14,2020-04-11,2020-04-13,0,Harris Insights & Analytics,C,0,0.41887746,0.0,False,a,all,2013.0,59.0,30.0,8.0,3.0,61.148549,27.831347,7.931115,2.0396212,21:45:20 14 Oct 2020,https://theharrispoll.com/wp-content/uploads/2020/04/Wave-2-7_tabs_rev.pdf
2020-10-14,2020-04-08,2020-04-13,1,Global Strategy Group/GBAO/Navigator Research,,1,0.04080572,0.0,False,rv,all,167.66667,40.0,33.0,17.5,9.5,36.48797,34.449109,16.947611,10.618814,21:45:23 14 Oct 2020,https://navigatorresearch.org/wp-content/uploads/2020/04/Navigator-Daily-Tracker-Topline-F04.13.20.pdf
2020-10-14,2020-04-08,2020-04-13,1,SSRS,B/C,0,1.2925383,0.0,False,a,all,1001.0,26.0,48.0,21.0,5.0,28.451267,44.550819,20.316293,6.0983986,21:45:23 14 Oct 2020,https://ssrs.com/wp-content/uploads/2020/04/SSRS-Coronavirus-Probability-Panel-Data-4.27.20-V2.pdf
2020-10-14,2020-04-10,2020-04-12,0,Morning Consult,B/C,0,0.31715543,0.0,False,a,all,2200.0,65.0,21.0,3.0,2.0,62.109742,24.503972,6.2688006,2.6497741,21:45:20 14 Oct 2020,https://morningconsult.com/wp-content/uploads/2020/04/200430_crosstabs_CORONAVIRUS_CONTENT_Adults_v2_JB.pdf
2020-10-14,2020-04-06,2020-04-12,1,Gallup,B,0,1.173251,0.0,False,a,all,7931.0,12.0,45.0,33.0,10.0,26.983621,40.097817,23.889916,7.3780074,21:45:23 14 Oct 2020,https://news.gallup.com/poll/308222/coronavirus-pandemic.aspx
2020-10-14,2020-04-10,2020-04-12,1,Gallup,B,0,0.34176213,0.0,False,a,all,2448.0,12.0,45.0,33.0,10.0,26.983621,40.097817,23.889916,7.3780074,21:45:23 14 Oct 2020,https://news.gallup.com/poll/308504/fear-covid-illness-financial-harm.aspx
2020-10-14,2020-04-09,2020-04-12,1,Léger,,0,0.32118163,0.0,False,a,all,1012.0,30.0,39.5,18.0,11.0,33.820666,38.964003,18.321945,8.3018622,21:45:23 14 Oct 2020,https://leger360.com/wp-content/uploads/2020/04/COVID-19-Tracking-Study-April-14-2020.pdf
2020-10-14,2020-04-10,2020-04-12,1,YouGov,B,0,0.17110621,0.0,False,a,all,1000.0,35.0,39.0,14.0,8.0,39.450464,36.378439,11.721761,7.715038,21:45:23 14 Oct 2020,https://big.assets.huffingtonpost.com/athena/files/2020/04/20/5e9e18a0c5b63c5b58734d00.pdf
2020-10-14,2020-04-08,2020-04-11,1,TargetSmart/William & Mary,B/C,0,1.001729,0.0,False,rv,all,1200.0,34.0,40.0,19.0,6.0,34.864328,38.813182,18.700867,6.25078,21:45:23 14 Oct 2020,https://insights.targetsmart.com/Analysis/covid_national_survey_april_2020/covid_toplines.pdf
2020-10-14,2020-04-07,2020-04-10,0,Global Strategy Group/GBAO/Navigator Research,,1,0.06772932,0.0,False,rv,all,251.25,44.0,40.0,11.0,5.0,51.314852,34.419535,9.2510295,4.0680561,21:45:20 14 Oct 2020,https://navigatorresearch.org/wp-content/uploads/2020/04/Navigator-Daily-Tracker-Topline-F04.10.20.pdf
2020-10-14,2020-04-04,2020-04-10,1,Optimus,B/C,1,0.1856328,0.0,False,a,all,410.57143,29.7,44.4,19.7,5.9,32.443239,42.530713,18.226173,6.0941837,21:45:23 14 Oct 2020,https://github.com/optimus-forecasting-and-polling/Firehouse-0ptimus-Coronavirus-Tracking/tree/master/April-13-2020
2020-10-14,2020-04-07,2020-04-10,1,Global Strategy Group/GBAO/Navigator Research,,1,0.06171166,0.0,False,rv,all,251.25,41.0,34.0,17.0,8.0,37.48797,35.449109,16.447611,9.1188139,21:45:23 14 Oct 2020,https://navigatorresearch.org/wp-content/uploads/2020/04/Navigator-Daily-Tracker-Topline-F04.10.20.pdf
2020-10-14,2020-04-09,2020-04-10,1,Ipsos,B-,0,0.59156213,0.0,False,a,all,1005.0,28.0,33.0,17.0,11.0,27.706481,29.438749,17.801208,13.206017,21:45:23 14 Oct 2020,https://www.ipsos.com/sites/default/files/ct/news/documents/2020-04/topline_usa_today_coronavirus_w2_041320.pdf
2020-10-14,2020-04-05,2020-04-09,0,Global Strategy Group/GBAO/Navigator Research,,1,0.11395993,0.0,False,rv,all,407.2,46.0,39.0,11.0,4.0,53.314852,33.419535,9.2510295,3.0680561,21:45:20 14 Oct 2020,https://navigatorresearch.org/wp-content/uploads/2020/04/Navigator-Daily-Tracker-Topline-F04.09.20.pdf
2020-10-14,2020-04-05,2020-04-09,1,Global Strategy Group/GBAO/Navigator Research,,1,0.10060907,0.0,False,rv,all,407.2,41.5,35.5,16.5,7.0,37.98797,36.949109,15.947611,8.1188139,21:45:23 14 Oct 2020,https://navigatorresearch.org/wp-content/uploads/2020/04/Navigator-Daily-Tracker-Topline-F04.09.20.pdf
2020-10-14,2020-04-07,2020-04-09,1,YouGov,B,0,0.33205334,0.0,False,a,all,2025.0,35.0,42.0,16.0,7.0,39.450464,39.378439,13.721761,6.715038,21:45:23 14 Oct 2020,https://drive.google.com/file/d/1Hgp-3ol9cEvQXjuoaRrMJf1rlJWJSZRO/view
2020-10-14,2020-04-08,2020-04-09,1,Ipsos,B-,0,0.30530798,0.0,False,a,all,512.0,43.0,43.0,11.0,3.0,42.706481,39.438749,11.801208,5.206017,21:45:23 14 Oct 2020,https://www.ipsos.com/sites/default/files/ct/news/documents/2020-04/topline-abc-coronavirus-041020_.pdf
2020-10-14,2020-04-03,2020-04-08,0,Global Strategy Group/GBAO/Navigator Research,,1,0.09760582,0.0,False,rv,all,340.66667,45.0,41.0,11.0,4.0,52.314852,35.419535,9.2510295,3.0680561,21:45:20 14 Oct 2020,https://navigatorresearch.org/wp-content/uploads/2020/04/Navigator-Daily-Tracker-Topline-F04.08.20.pdf
2020-10-14,2020-04-03,2020-04-08,1,Global Strategy Group/GBAO/Navigator Research,,1,0.08451023,0.0,False,rv,all,340.66667,41.5,34.0,18.0,6.5,37.98797,35.449109,17.447611,7.6188139,21:45:23 14 Oct 2020,https://navigatorresearch.org/wp-content/uploads/2020/04/Navigator-Daily-Tracker-Topline-F04.08.20.pdf
2020-10-14,2020-04-02,2020-04-07,0,Global Strategy Group/GBAO/Navigator Research,,1,0.04951984,0.0,False,rv,all,167.83333,45.0,38.0,12.0,5.0,52.314852,32.419535,10.251029,4.0680561,21:45:20 14 Oct 2020,https://navigatorresearch.org/wp-content/uploads/2020/04/Navigator-Daily-Tracker-Topline-F04.07.20.pdf
2020-10-14,2020-04-04,2020-04-07,0,Fox News/Beacon Research/Shaw & Co. Research,A-,0,1.8499151,0.0,False,rv,all,1107.0,61.0,29.0,5.0,3.0,60.077947,29.127762,6.1672728,2.9082299,21:45:20 14 Oct 2020,https://www.scribd.com/document/455760294/Fox-News-Poll-April-4-7-2020
2020-10-14,2020-04-03,2020-04-07,1,Monmouth University,A+,0,1.8904141,0.0,False,a,all,857.0,50.0,33.0,9.0,7.0,44.905941,35.893968,11.482392,5.9066502,21:45:23 14 Oct 2020,https://www.monmouth.edu/polling-institute/documents/monmouthpoll_us_041320.pdf/
2020-10-14,2020-04-02,2020-04-07,1,Global Strategy Group/GBAO/Navigator Research,,1,0.04200001,0.0,False,rv,all,167.83333,41.0,34.5,17.5,7.0,37.48797,35.949109,16.947611,8.1188139,21:45:23 14 Oct 2020,https://navigatorresearch.org/wp-content/uploads/2020/04/Navigator-Daily-Tracker-Topline-F04.07.20.pdf
2020-10-14,2020-04-03,2020-04-07,1,Climate Nexus,,0,1.1533979,0.0,False,a,all,3933.0,43.0,35.0,12.0,7.0,39.851502,35.576737,14.409477,7.5504697,21:45:23 14 Oct 2020,https://climatecommunication.yale.edu/wp-content/uploads/2020/04/americans-risk-perceptions-and-emotional-responses-to-covid-19-april-2020.pdf
2020-10-14,2020-04-05,2020-04-07,1,YouGov,B,0,0.24099677,0.0,False,a,all,1500.0,27.0,42.0,23.0,8.0,31.450464,39.378439,20.721761,7.715038,21:45:23 14 Oct 2020,https://docs.cdn.yougov.com/ogvntw3mu9/econTabReport.pdf
